,tweet_id,handle,retweet_count,text,mined_at,created_at
522,1197203616018423811,Giorgia_Meloni,226,"Il M5S è alla frutta! Per tentare di distogliere l'attenzione dai loro continui disastri, scandali e tradimenti nei confronti degli elettori, ormai diffondono quotidianamente falsità su di me e #FratellidItalia. Qualcuno può informarli che stanno al governo e non all'opposizione? https://t.co/jecFkatnms",2020-02-26 17:35:06.468126,Wed Nov 20 17:22:39 +0000 2019
523,1197181383141187585,Giorgia_Meloni,561,"Se il PD e Il M5S considerano così importante la manifestazione delle #sardine, allora ascoltino anche i 30.000 italiani scesi in piazza Montecitorio e si dimettano! https://t.co/r7LIxG2sQy",2020-02-26 17:35:06.468487,Wed Nov 20 15:54:18 +0000 2019
524,1197108419192401920,Giorgia_Meloni,442,"Dopo lo scandalo della casa a cui non voleva rinunciare, ora si aggiunge la scorta con l'#autoblu (pagata dai contribuenti) al cane dell'ex Ministro #Trenta. Alla faccia della lotta ai privilegi del M5S! 🤣 https://t.co/awSqDWK8Ir",2020-02-26 17:35:06.468665,Wed Nov 20 11:04:22 +0000 2019
525,1197088547813150720,Giorgia_Meloni,392,La cittadinanza italiana non può e non deve essere un automatismo. Continueremo a fare le barricate per impedire l'ennesima follia anti-italiana. #NoIusSoli https://t.co/3IBcWo01nz,2020-02-26 17:35:06.468882,Wed Nov 20 09:45:25 +0000 2019
526,1197068029479141376,Giorgia_Meloni,889,L’Italia contribuisce con decine di miliardi a un fondo al quale non potrà accedere. L'ennesimo delirio utile solo alla Germania. #FratellidItalia dice #StopMes! https://t.co/FDhLihbrJ7,2020-02-26 17:35:06.469050,Wed Nov 20 08:23:53 +0000 2019
527,1196881513645780994,Giorgia_Meloni,376,"I 5 stelle, non sapendo come spiegare la vicenda che coinvolge l'ex Ministro #Trenta, tornano ad attaccarmi per spostare l’attenzione. Dicono che non meriterei lo stipendio. Peccato che io risulti tra i primi deputati per produttività.

Continua a leggere: https://t.co/XpastjyjQg https://t.co/OLjWwsmBR5",2020-02-26 17:35:06.469236,Tue Nov 19 20:02:44 +0000 2019
528,1196776817904013312,Giorgia_Meloni,365,"Finalmente lo ammettono anche loro, il Movimento 5 Stelle ha tradito gli elettori per qualche poltrona governativa. Come ci si può ancora fidare del M5S? https://t.co/t7H3m1EKWK",2020-02-26 17:35:06.469509,Tue Nov 19 13:06:43 +0000 2019
529,1196759525275123713,Giorgia_Meloni,118,#FratellidItalia scende ancora una volta in piazza al fianco dei #VigilidelFuoco: eroi che rischiano la vita per la nostra sicurezza e che devono essere equiparati alle altre forze di polizia. Per questo abbiamo presentato in Parlamento delle proposte per difendere i loro diritti https://t.co/mALo9epE5j,2020-02-26 17:35:06.469677,Tue Nov 19 11:58:00 +0000 2019
530,1196721197783953409,Giorgia_Meloni,236,"Le donne sono una risorsa fondamentale per la crescita della Nazione, bisogna garantire a chi lo vuole di poter essere madre e lavoratrice senza essere penalizzata.
Ecco la mia intervista di oggi a @leggoit ⬇️ @davidedesario
https://t.co/YcUT76OJfd",2020-02-26 17:35:06.469957,Tue Nov 19 09:25:42 +0000 2019
531,1196705435778199552,Giorgia_Meloni,74,"Buongiorno! Ore 21.45 sarò a #fuoridalcoro, su Rete 4. Seguitemi se potete. https://t.co/9tYVPYLDi0",2020-02-26 17:35:06.470187,Tue Nov 19 08:23:04 +0000 2019
532,1196506612883771397,Giorgia_Meloni,95,"Evviva il grande Iginio Massari! Il suo impegno e la sua maestria vengono ancora una volta premiati e riconosciuti eccellenza italiana 💪🏻 @iginiomassari
https://t.co/MHAOJbiMkW",2020-02-26 17:35:06.470287,Mon Nov 18 19:13:01 +0000 2019
533,1196492152605425675,Giorgia_Meloni,420,"Ius Soli, porti aperti, aumento delle tasse: se ai partiti del Governo più anti-italiano della storia è rimasto un briciolo di dignità, si presentino al cospetto dei cittadini in libere elezioni e vediamo gli italiani chi scelgono. #NoIusSoli https://t.co/Ns2Q0fytTB",2020-02-26 17:35:06.470453,Mon Nov 18 18:15:33 +0000 2019
534,1196470937585106944,Giorgia_Meloni,223,Bene il bonus traslochi chiesto dal M5S. Così magari la #Trenta si decide a lasciare l’alloggio di servizio che non le spetta. https://t.co/UwaVAUagYt,2020-02-26 17:35:06.470699,Mon Nov 18 16:51:15 +0000 2019
535,1196451172674129921,Giorgia_Meloni,73,FDI mantiene le promesse: grazie al governatore @marcomarsilio arriva finalmente via libera al prolungamento della pista di volo dell’aeroporto d’Abruzzo. Intervento strategico atteso da anni che permetterà allo scalo di diventare hub nazionale e ospitare voli intercontinentali. https://t.co/qsvxW3TRQ3,2020-02-26 17:35:06.470841,Mon Nov 18 15:32:43 +0000 2019
536,1196417159674642433,Giorgia_Meloni,433,Grazie a @Santi_ABASCAL per le belle parole che mi ha dedicato nella sua intervista a Libero. Insieme per un'Italia e una Spagna a testa alta in Europa! 🇮🇹🇪🇸 https://t.co/ql5CN9gBdX,2020-02-26 17:35:06.471128,Mon Nov 18 13:17:33 +0000 2019
537,1196383713128407041,Giorgia_Meloni,1299,"Conte ha dato ok a riforma Fondo salva stati (MES) senza coinvolgere il Parlamento, che entro Dicembre sarà chiamato a ratificare questa nuova eurofollia: una super Troika onnipotente. FDI farà barricate contro ennesimo tradimento verso il popolo. #StopMes
https://t.co/AO2gioqF5J",2020-02-26 17:35:06.471300,Mon Nov 18 11:04:39 +0000 2019
538,1196143339122446336,Giorgia_Meloni,72,"Ci vediamo domattina, ore 8.35, su Rai1! #18novembre #UnoMattina https://t.co/4gVOftRAFq",2020-02-26 17:35:06.471562,Sun Nov 17 19:09:29 +0000 2019
539,1196107434189832192,Giorgia_Meloni,1125,"Zingaretti e Pd gettano la maschera e dicono di volersi battere per lo #iussoli. Hanno ingannato italiani parlando di #iusculturae, ma hanno sempre voluto dare cittadinanza automatica agli immigrati. FDI continuerà raccolta firme e farà barricate in Parlamento per dire #NoIusSoli https://t.co/RicvOlBYur",2020-02-26 17:35:06.471647,Sun Nov 17 16:46:49 +0000 2019
540,1196074215537025029,Giorgia_Meloni,539,"Delrio del PD esclama: “La #Meloni non mi porterà via il #Tricolore, perché appartiene a me prima che a lei"". Sono contenta se la sinistra riscopre l’amor patrio. Speriamo però il PD non voglia consegnarlo in ginocchio a francesi e tedeschi, come ha provato a fare in questi anni. https://t.co/whF85vKMtS",2020-02-26 17:35:06.471930,Sun Nov 17 14:34:49 +0000 2019
541,1196025333360873472,Giorgia_Meloni,565,"Abbiamo una sinistra che, non essendo in grado di competere sul merito, deve criminalizzare l'avversario. Invece di passare il tempo a creare il mostro, lo dedichino a cercare programmi più seri da controproporre al nostro. https://t.co/gnvDefpv0y",2020-02-26 17:35:06.472223,Sun Nov 17 11:20:35 +0000 2019
542,1195981212201951232,Giorgia_Meloni,284,"Che incanto queste immagini. 
#BuonaDomenica Italia! 🇮🇹 https://t.co/Q8M7YNs7NP",2020-02-26 17:35:06.472468,Sun Nov 17 08:25:15 +0000 2019
543,1195763671936450560,Giorgia_Meloni,221,"Dal #SuperCatShow, la mostra internazionale felina, nell’area adozioni dell’ARCA ONLUS: aiutiamo chi si prende cura dei mici di strada a trovargli una casa. Siete in tempo fino a domani! https://t.co/3HZ6iMrPsX",2020-02-26 17:35:06.472548,Sat Nov 16 18:00:50 +0000 2019
544,1195696128286756864,Giorgia_Meloni,290,Prima ci impediscono di votare con la scusa di scongiurare l'#aumentoIVA e ora bastonano cittadini e imprese con ogni tipo di tassa. Hanno mentito e tradito gli italiani: devono andare a casa. https://t.co/RLfF4dLwDe,2020-02-26 17:35:06.472748,Sat Nov 16 13:32:26 +0000 2019
545,1195662297617883136,Giorgia_Meloni,426,"Sgominata banda di Rom spacciatori, molti di loro percepivano il #redditodicittadinanza. Questo Governo è il paradiso di nomadi, spacciatori, brigatisti e condannati vari. Per gli italiani perbene costretti a pagare per tutto ciò, un incubo. https://t.co/cWA8hR6oRr",2020-02-26 17:35:06.472950,Sat Nov 16 11:18:00 +0000 2019
546,1195632576364453889,Giorgia_Meloni,799,"Ecco quello che nessuno dice sull'immigrazione clandestina. #CarolaRackete ha dichiarato che l'indicazione di andare a prendere gli immigrati, portandoli in Italia, l'ha avuta dal governo tedesco. Non permetteremo che l'Italia si trasformi nel campo profughi d'Europa! https://t.co/ejq46RWzxk",2020-02-26 17:35:06.473198,Sat Nov 16 09:19:54 +0000 2019
547,1195408119565881345,Giorgia_Meloni,631,"Mentre De Magistris continua con i sermoni sull’accoglienza, nel quartiere Vasto di #Napoli i residenti vivono ostaggio nelle loro abitazioni a causa della criminalità degli immigrati irregolari. De Magistris faccia il suo dovere e per una volta si occupi dei cittadini napoletani https://t.co/hMTSUeFzif",2020-02-26 17:35:06.473463,Fri Nov 15 18:27:59 +0000 2019
548,1195369209515192327,Giorgia_Meloni,463,"Ormai questo è il calibro dei commenti che quotidianamente mi dedicano in rete gli stessi che poi accusano la destra di seminare odio in rete.
Non fate paura a nessuno, solo tanta tristezza 😉 https://t.co/AzCV4a1LP8",2020-02-26 17:35:06.473731,Fri Nov 15 15:53:23 +0000 2019
549,1195346190616989696,Giorgia_Meloni,125,Appello a Conte: Governo blocchi pagamento tributi per attività delle città e dei Comuni messi in ginocchio dal #maltempo. Giá lunedì FDI presenterà una mozione alla Camera dei Deputati per sostenere le zone colpite dalle intemperie: aiutiamo i cittadini e le aziende a ripartire! https://t.co/jn8z7abEPH,2020-02-26 17:35:06.473908,Fri Nov 15 14:21:54 +0000 2019
550,1195300267404775424,Giorgia_Meloni,178,"I #VigiliDelFuoco aspettano da anni adeguamento stipendiale e previdenziale alle altre Forze dell’Ordine. Alla Camera la maggioranza ha rinviato la nostra risoluzione. Al Senato sono pronti i nostri emendamenti. FDI c'è: basta mancette e pacche sulla spalle, è tempo di risposte. https://t.co/Qsd2bu5z4l",2020-02-26 17:35:06.474149,Fri Nov 15 11:19:26 +0000 2019
551,1195091405347205128,Giorgia_Meloni,35,"🔴 #FratellidItalia c'è: siamo pronti a fare tutto ciò che serve per restituire l'agibilità a #Venezia. Il #Mose è un'opera i cui costi sono lievitati ed è incredibile che ancora non funzioni.

📺 #DrittoeRovescio #Meloni https://t.co/QumBUDB3E0",2020-02-26 17:35:06.474402,Thu Nov 14 21:29:29 +0000 2019
552,1195089717018210305,Giorgia_Meloni,55,"🔴 Mi sono commossa di fronte alle immagini di ieri: #Venezia è una carta di identità dell'Italia e vederla così mi ha devastata. Voglio dire ai #veneziani che noi ci siamo e voglio dirlo anche a #Matera, che è una città ugualmente importante.

📺 #DrittoeRovescio #Meloni https://t.co/ABueQk2Sb9",2020-02-26 17:35:06.474607,Thu Nov 14 21:22:46 +0000 2019
553,1195087949869785088,Giorgia_Meloni,68,"🔴 Sull'#Ilva possiamo chiedere una riunione dei Ministri europei competenti? Abbiamo spiegato alla #Merkel che se chiude l'Ilva l'industria automobilistica tedesca deve andare a cercarsi l'acciaio di qualità fuori dai confini UE a costi maggiori?

📺 #DrittoeRovescio #Meloni https://t.co/D1MFOhfeUl",2020-02-26 17:35:06.474848,Thu Nov 14 21:15:45 +0000 2019
554,1195086173313622017,Giorgia_Meloni,97,"🔴 Lezioni di coerenza da Di Maio non ne accetto: ha tradito tutto quello che poteva tradire e gli ricordo che la poltrona grazie ai voti di Monti ce l'ha lui.

📺 #DrittoeRovescio #Meloni https://t.co/NyQrG3MqIN",2020-02-26 17:35:06.475092,Thu Nov 14 21:08:42 +0000 2019
555,1195082545031000079,Giorgia_Meloni,404,"#CarolaRackete ha dichiarato che l'indicazione di andare a prendere gli immigrati, portandoli in Italia, l'ha avuta dal governo tedesco. Ci sono pezzi di Ue che pensano di trasformare l'Italia nel più grande campo profughi d'Europa. Non lo permetteremo.

#DrittoeRovescio #Meloni https://t.co/0BbRqSN4JD",2020-02-26 17:35:06.475260,Thu Nov 14 20:54:16 +0000 2019
556,1195081334630309888,Giorgia_Meloni,90,"🔴 In Italia la sinistra non sa competere seriamente sulle questioni, perciò deve criminalizzare l'avversario dicendo che incitiamo l'odio contro l'immigrazione. Ma io non ce l'ho con gli immigrati, io ce l'ho con chi li sfrutta.

📺 #DrittoeRovescio #Meloni https://t.co/YNXPqF9JwS",2020-02-26 17:35:06.475502,Thu Nov 14 20:49:28 +0000 2019
557,1195080270002761732,Giorgia_Meloni,125,"🔴Gandhi diceva: ""Prima ti ignorano, poi ti deridono, poi ti combattono. Poi vinci"". Più sei forte, più i tuoi avversari ti insultano. Siccome la sinistra non sa rispondere alle mie idee nel merito, dice che istigo l'odio. Invece sono loro che istigano l’odio.

📺#DrittoeRovescio https://t.co/MP8gLB7JEV",2020-02-26 17:35:06.475734,Thu Nov 14 20:45:14 +0000 2019
558,1195034323273027584,Giorgia_Meloni,227,"Oggi il M5S ha detto no all’introduzione del #ReatodiBullismo proposto da #FratellidItalia. Continueremo in Aula nostra battaglia contro #bullismo: lo dobbiamo alle vittime di questo odioso crimine come Antonio Stano, pensionato torturato da una baby gang e poi tragicamente morto https://t.co/848tBGcG5i",2020-02-26 17:35:06.475983,Thu Nov 14 17:42:39 +0000 2019
559,1194989347088601092,Giorgia_Meloni,906,"Prima era ""discriminatorio"" il #crocifisso, poi il #presepe, ora le recite di #Natale. 
Ma sono i bimbi a sentirsi offesi, o è il fanatismo ideologico di qualche dirigente a spingere per censurare ogni simbolo e tradizione della nostra cultura?
https://t.co/BTAnS4Lnry",2020-02-26 17:35:06.476239,Thu Nov 14 14:43:56 +0000 2019
560,1194953773061410816,Giorgia_Meloni,633,"“Hanno preso in giro gli italiani. State tassando la povera gente, lo volete capire?”.
Un grande Maurizio Belpietro smonta le bugie del Governo pentapiddino sulle tasse e sull'IVA. Da ascoltare! @BelpietroTweet https://t.co/yedqCx3nIi",2020-02-26 17:35:06.476469,Thu Nov 14 12:22:35 +0000 2019
561,1194899437262397440,Giorgia_Meloni,135,"Buongiorno! Oggi #14Novembre, ore 21.30, sarò a #DrittoeRovescio su Rete 4. Mi seguite? https://t.co/VcTuS2nqVq",2020-02-26 17:35:06.476659,Thu Nov 14 08:46:40 +0000 2019
562,1194691937653186560,Giorgia_Meloni,295,Immagini che fanno bene al cuore. Il mondo ha molto da imparare dai più piccoli ❤️ https://t.co/9rKkjq8bWd,2020-02-26 17:35:06.476762,Wed Nov 13 19:02:08 +0000 2019
563,1194635620259262465,Giorgia_Meloni,752,"Di Maio ha sbagliato i calcoli: a differenza sua, io mi sono sempre fatta votare ed eleggere e ho sempre mantenuto il vincolo di mandato. Lui che ora si fa dare gli ordini dai partiti che voleva combattere, dovrebbe stare in silenzio e chiedere scusa ai suoi elettori! https://t.co/QVOBIR8bQr",2020-02-26 17:35:06.476850,Wed Nov 13 15:18:21 +0000 2019
564,1194604743890477057,Giorgia_Meloni,183,Si aggrava l'emergenza occupazione nel Sud con un nuovo capitolo della vertenza #Almaviva: 150 dipendenti della sede di #Napoli rischiano il licenziamento per un cambio di appalto e l'esclusione dalla clausola sociale. Il Governo apra subito un tavolo per difendere i lavoratori.,2020-02-26 17:35:06.477084,Wed Nov 13 13:15:40 +0000 2019
565,1194579895185289223,Giorgia_Meloni,170,"Sono vicina ai veneziani e al sindaco @LuigiBrugnaro.
#Venezia è un tesoro inestimabile per l'Italia e il mondo intero, FDI chiederà al Governo di stanziare risorse necessarie per i danni causati dalla marea eccezionale e per non sprecare le moltissime risorse investite nel #MOSE https://t.co/N4xJ2pI6bQ",2020-02-26 17:35:06.477324,Wed Nov 13 11:36:55 +0000 2019
566,1194532621319053315,Giorgia_Meloni,1247,"Accusano la destra di essere ""ambigua"" sull'antisemitismo e poi vorrebbero in Rai un signore che scrive ""sionisti cancro del mondo"". Ma non si vergognano nemmeno un pochino? https://t.co/YuDAIPxgav",2020-02-26 17:35:06.477565,Wed Nov 13 08:29:04 +0000 2019
567,1194272995050762240,Giorgia_Meloni,1119,"Nei gruppi di sinistra, oltre le offese, ora si passa direttamente alle minacce di morte nei miei confronti. Per i media e i politici di sinistra che accusano me di ""seminare odio"" tutto regolare? https://t.co/Dx1OwiIz8o",2020-02-26 17:35:06.477720,Tue Nov 12 15:17:25 +0000 2019
568,1194250979459383301,Giorgia_Meloni,69,"Ci vediamo questa sera a @OttoemezzoTW su La7!

📺 #ottoemezzo #Meloni https://t.co/PB3d5ckiAS",2020-02-26 17:35:06.477893,Tue Nov 12 13:49:56 +0000 2019
569,1194210765076680705,Giorgia_Meloni,41,"Conferenza stampa per la presentazione delle iniziative di #FratellidItalia in materia di telecomunicazioni.
Collegatevi! ⬇️
https://t.co/fPJJrUOzU6 https://t.co/zxUo1zjQMF",2020-02-26 17:35:06.477968,Tue Nov 12 11:10:08 +0000 2019
570,1194199742953263104,Giorgia_Meloni,195,"#12Novembre: Giornata del ricordo dei caduti militari e civili nelle missioni di pace, istituita nella ricorrenza dell'attentato di #Nassiriya. Oggi l'Italia ringrazia chi nei teatri di guerra e nelle aree di crisi è in prima linea per difendere la libertà e combattere terrorismo https://t.co/ZQPJ4xl0Ot",2020-02-26 17:35:06.478103,Tue Nov 12 10:26:20 +0000 2019
571,1194020720784953344,Giorgia_Meloni,85,"Gentile @M_gabanelli dispiace che non si sia accorta delle critiche che da molto tempo io e @FratellidItaIia muoviamo ai nuovi ISA, peggiori addirittura degli studi di settore. Avrebbe potuto aiutarci a contrastarli @DataroomCorsera https://t.co/AF2dRYsAKL",2020-02-26 17:35:06.478346,Mon Nov 11 22:34:58 +0000 2019
572,1193998398917107712,Giorgia_Meloni,374,"@reportrai3 Caro Ranucci, se denuncio e #Report perde, i danni li pagate tu e Report, o li paga mamma RAI coi soldi dei contribuenti? Raccontalo agli italiani.",2020-02-26 17:35:06.478548,Mon Nov 11 21:06:16 +0000 2019
573,1193992834384322560,Giorgia_Meloni,606,"Oggi a #Report campionato mondiale di arrampicata sugli specchi. Abbiamo già smentito tutte le false accuse dell’altra puntata, oggi invece di rispondere nel merito o chiedere scusa provano a confondere le acque. Che brutta fine @reportrai3",2020-02-26 17:35:06.478667,Mon Nov 11 20:44:09 +0000 2019
574,1193985403344375809,Giorgia_Meloni,847,"Orfini, deputato del PD, vuole dare la residenza a chi occupa abusivamente le case altrui. Ormai la sinistra è sempre schierata con i delinquenti contro gli italiani onesti. Chi occupa abusivamente va sgomberato, non premiato e coccolato. https://t.co/c85itSeMZY",2020-02-26 17:35:06.478851,Mon Nov 11 20:14:37 +0000 2019
575,1193973607619321857,Giorgia_Meloni,115,#ISIS rivendica attentato in #Iraq contro militari italiani e uccide 2 sacerdoti in #Siria. La morte di Al Baghdadi non ha fermato i terroristi islamici e la guerra alla bestia islamista non è finita. L'attenzione deve rimanere alta e l'Occidente deve uscire dalla sua ambiguità. https://t.co/5TfNy2xEh6,2020-02-26 17:35:06.479033,Mon Nov 11 19:27:45 +0000 2019
576,1193920177928364033,Giorgia_Meloni,185,"Gli Indici Sintetici di Affidabilità sono peggio degli Studi di settore. Inutili a combattere evasione, servono solo a torchiare contribuenti. FDI lo ha sempre denunciato, ora lo dice anche Gabanelli. Basta oppressione fiscale! No studi di settore, no ISA! https://t.co/arBjGdHikT",2020-02-26 17:35:06.479245,Mon Nov 11 15:55:27 +0000 2019
577,1193892219637374976,Giorgia_Meloni,149,"Un abbraccio fortissimo ad Alessandro Di Battista e alla sua famiglia in questo momento di dolore. Da parte mia e di @FratellidItaIia tutta le più sentite condoglianze per la scomparsa della signora Maria Grazia.
@ale_dibattista",2020-02-26 17:35:06.479438,Mon Nov 11 14:04:21 +0000 2019
578,1193877639817289728,Giorgia_Meloni,116,"@Vox_es è il 3° partito di Spagna perché difende l’unità nazionale senza se e senza ma e si oppone a quella che @Santi_ABASCAL chiama “dittatura progre”, che vuole distruggere identità e sovranità. La nostra battaglia comune continuerà. Insieme cambieremo questa Europa @ecrgroup",2020-02-26 17:35:06.479601,Mon Nov 11 13:06:25 +0000 2019
579,1193848121312337922,Giorgia_Meloni,387,Grazie al direttore Vittorio Feltri per le belle parole! @vfeltri https://t.co/afTq8olw4L,2020-02-26 17:35:06.479814,Mon Nov 11 11:09:07 +0000 2019
580,1193607958896271365,Giorgia_Meloni,792,"Alle elezioni spagnole grande affermazione di @vox_es, alleato di @FratellidItaIia nel gruppo dei Conservatori europei. Sull’unità e sulla sovranità nazionale non si fanno compromessi... in Spagna come in Italia la coerenza paga!",2020-02-26 17:35:06.479871,Sun Nov 10 19:14:48 +0000 2019
581,1193588607979859968,Giorgia_Meloni,54,"Secondo quanto si apprende, tra i 5 feriti ci sarebbero anche tre militari della Marina @ItalianNavy. A loro e a tutte le nostre Forze Armate va la nostra solidarietà e il nostro ringraziamento per il lavoro che svolgono per garantire la pace e la nostra sicurezza.",2020-02-26 17:35:06.480045,Sun Nov 10 17:57:54 +0000 2019
582,1193558366171389953,Giorgia_Meloni,180,"Seguiamo con apprensione notizie dall'#Iraq, dove 5 militari italiani impiegati in attività di addestramento delle forze di sicurezza irachene impegnate nella lotta all'Isis sono rimasti feriti in un attentato esplosivo. Ci stringiamo ai feriti, alle loro famiglie e all'@Esercito https://t.co/k2XJEIRQxV",2020-02-26 17:35:06.480243,Sun Nov 10 15:57:44 +0000 2019
583,1193481279242719232,Giorgia_Meloni,1252,"Oggi si vota in #Spagna. Siamo al fianco di @Santi_ABASCAL e degli amici di @vox_es, che insieme a FDI fanno parte della famiglia dei conservatori europei di @ECRparty. Gli spagnoli premieranno la vostra coerenza e la battaglia contro il secessionismo per una Spagna unita e forte https://t.co/dcZ2TJXUzN",2020-02-26 17:35:06.480461,Sun Nov 10 10:51:25 +0000 2019
584,1193451909950164992,Giorgia_Meloni,783,"Norma Cossetto fu seviziata, stuprata e barbaramente uccisa dai partigiani di Tito. Massacrata per non aver rinnegato l'amore per l’Italia. Dedicarle quel titolo è irrispettoso per lei e offende tutti gli esuli istriani e dalmati infoibati, vittime dell’odio comunista. Vergogna! https://t.co/bM4RVzjaf3",2020-02-26 17:35:06.480672,Sun Nov 10 08:54:43 +0000 2019
585,1193240909116252161,Giorgia_Meloni,315,@pdnetwork Guardate che voi eravate il muro.,2020-02-26 17:35:06.480892,Sat Nov 09 18:56:16 +0000 2019
586,1193210624400134144,Giorgia_Meloni,132,"Grazie Milano! 😘

Riascolta qui il mio intervento per il trentesimo anniversario della caduta del #MurodiBerlino: https://t.co/bhmuixwBRu https://t.co/OQZqzfWAlk",2020-02-26 17:35:06.480928,Sat Nov 09 16:55:56 +0000 2019
587,1193142069268828160,Giorgia_Meloni,773,In bocca al lupo a @Santi_ABASCAL e agli amici di @Vox_Es per le elezioni di domani. Gli spagnoli sapranno premiare la vostra coerenza e il vostro amore incondizionato per la Spagna. https://t.co/5SfNhcggfh,2020-02-26 17:35:06.481033,Sat Nov 09 12:23:31 +0000 2019
588,1193087267683885058,Giorgia_Meloni,104,"Oggi #9novembre a Milano, ore 15, per la manifestazione “9 novembre Giorno della Libertà. 30esimo anniversario della caduta del Muro di Berlino”. Vi Aspetto!
#MuroDiBerlino #BerlinWall30 https://t.co/EdIIuAQGWz",2020-02-26 17:35:06.481175,Sat Nov 09 08:45:45 +0000 2019
589,1192904452967153665,Giorgia_Meloni,574,"Scandaloso! UE finanzia il sedicente “Rapporto sull'islamofobia europea” di una Fondazione legata a #Erdogan, che dice che in Italia cresce l'islamofobia anche a causa di FDI. Una scusa per censurare chi difende nostra identità, ma non ci faremo intimidire
https://t.co/9ioZKUhMCq",2020-02-26 17:35:06.481341,Fri Nov 08 20:39:19 +0000 2019
590,1192877387207389186,Giorgia_Meloni,34,"MuovitItalia19: rivedi il mio intervento da Catania ⬇️
https://t.co/4RM8IyK9FP https://t.co/a5PfZye1U0",2020-02-26 17:35:06.481545,Fri Nov 08 18:51:46 +0000 2019
591,1192838728789745664,Giorgia_Meloni,105,"Conoscete i dolcetti di Sant'Agata? 
Una straordinaria eccellenza catanese. https://t.co/mHS0NpDlMj",2020-02-26 17:35:06.481608,Fri Nov 08 16:18:09 +0000 2019
592,1192782328793305088,Giorgia_Meloni,761,"Con questo commovente omaggio di un Vigile del Fuoco ai suoi colleghi, rivolgiamo l'ultimo saluto a Antonio, Marco e Matteo. Grazie per aver svolto con coraggio e dedizione il vostro lavoro. Riposate in pace. https://t.co/MLkEFZW3Ow",2020-02-26 17:35:06.481678,Fri Nov 08 12:34:02 +0000 2019
593,1192764276982927360,Giorgia_Meloni,133,"Per @Open_gol sarei favorevole a discriminare i gay? Combattere discriminazioni non vuol dire essere per forza a favore di adozioni omosessuali, #uteroinaffitto o genitore 1 e 2 al posto di mamma e papà. Capisco si voglia dipingere il mostro, ma non mi sembra difficile da capire. https://t.co/KB1XyHKDtI",2020-02-26 17:35:06.481835,Fri Nov 08 11:22:18 +0000 2019
594,1192753358127423488,Giorgia_Meloni,48,"Buongiorno! Oggi a #8novembre a #Catania per l’evento “Muovititalia 19"". Vi aspetto! https://t.co/N7kqnWNnKS",2020-02-26 17:35:06.482051,Fri Nov 08 10:38:55 +0000 2019
595,1192734906234875905,Giorgia_Meloni,223,"Oggi ci lascia un’altra icona della musica italiana. Addio #FredBongusto, la tua rotonda sul mare ha accompagnato più generazioni e fatto innamorare migliaia di italiani. https://t.co/BnLIV0X9fZ",2020-02-26 17:35:06.482136,Fri Nov 08 09:25:36 +0000 2019
596,1192523414369648640,Giorgia_Meloni,691,"Dopo aver rischiato di chiudere, ora la #Melegatti verrà danneggiata anche dalle tasse del Governo pentapiddino. 
Quante aziende saranno penalizzate e rischieranno di chiudere per colpa di questo Governo ammazza-imprese? https://t.co/dLClVgCsT2",2020-02-26 17:35:06.482274,Thu Nov 07 19:25:12 +0000 2019
597,1192451754497056769,Giorgia_Meloni,531,Non contate su #FratellidItalia per eleggere #Draghi Presidente della Repubblica. Per noi il prossimo Presidente deve avere alle spalle una storia di difesa dell’economia reale e interessi nazionali. Anche per questo stiamo raccogliendo firme per elezione diretta Capo dello Stato https://t.co/exr2AGTwUJ,2020-02-26 17:35:06.807889,Thu Nov 07 14:40:27 +0000 2019
