,tweet_id,handle,retweet_count,text,mined_at,created_at
0,1232705559675183109,Giorgia_Meloni,0,"#Roma assente da spot Italia per @expo2020dubai. Dopo promesse mancate e impegni mai mantenuti su poteri e risorse, ecco la conferma dell’attenzione che Governo M5S-Pd riserva alla Capitale. FDI chiede all’Esecutivo di cancellare questo oltraggio e dare a Roma spazio che merita https://t.co/iCxAegIlWq",2020-02-26 17:35:04.190597,Wed Feb 26 16:34:42 +0000 2020
1,1232661855665037312,Giorgia_Meloni,331,Sul #Coronavirus ennesima dimostrazione di un'Europa assente sulle grandi questioni e troppo presente in altre non necessarie. In questa emergenza sarebbe stato ragionevole che l'Europa si fosse messa a tavolino per stabilire un unico protocollo valido per tutti gli Stati membri https://t.co/64p25NsTth,2020-02-26 17:35:04.191081,Wed Feb 26 13:41:02 +0000 2020
2,1232409610922987520,Giorgia_Meloni,438,"Possibile che i casi di #coronavirus siano così elevati solo in Italia? Commissione UE chieda a Stati membri un rapporto sulle cause delle morti naturali sui loro territori. Per la sicurezza di tutti e per evitare danno economico e d’immagine all’Italia, controlli siano uniformi https://t.co/JYnmnFAPWP",2020-02-26 17:35:04.191515,Tue Feb 25 20:58:42 +0000 2020
3,1232319650337185798,Giorgia_Meloni,204,"A partire dalle ore 20.30, sarò ospite a #ottoemezzo su La7.
Seguitemi se potete!
📺 #Meloni @OttoemezzoTW https://t.co/uWkWspAte7",2020-02-26 17:35:04.191959,Tue Feb 25 15:01:14 +0000 2020
4,1232226638575947776,Giorgia_Meloni,874,"Due drag queen parleranno di ""inclusione"" e ""amicizia"" a bambini dai 3 anni in su in una scuola di Roma. Il tutto pubblicizzato sul sito ufficiale del Campidoglio. Solo a me sembra una follia? Giù le mani dai bambini! https://t.co/tBUVvFZF4p",2020-02-26 17:35:04.192159,Tue Feb 25 08:51:38 +0000 2020
5,1231988675656978432,Giorgia_Meloni,348,"🔴 No allo sciacallaggio! Governo metta in campo misure necessarie per non permettere ignobile speculazione sui prodotti igienizzanti, bloccando i prezzi di vendita. Non si può promuovere la prevenzione e poi permettere a qualcuno di lucrare sulla salute dei cittadini. #Covid_19 https://t.co/XbMDQ28cI8",2020-02-26 17:35:04.192513,Mon Feb 24 17:06:04 +0000 2020
6,1231968941347680257,Giorgia_Meloni,151,"Posizione FDI sul governo non cambia, ma siamo pronti a dare una mano per tutelare salute cittadini, sostenere misure utili a contenere contagio #COVID19 e a scongiurare dramma economico. Stiamo presentando diverse proposte per difendere le imprese dall’enorme rischio che corrono https://t.co/BdVSQQZpyY",2020-02-26 17:35:04.192958,Mon Feb 24 15:47:39 +0000 2020
7,1231943405019815936,Giorgia_Meloni,155,"🔴Sospensione immediata scadenze per i contribuenti nelle zone focolaio del #coronavirus! Finché situazione non tornerà alla normalità deve essere compito dello Stato tutelare cittadini, professionisti, artigiani e Partite Iva, anche da adempimenti e scadenze economiche. #COVID19 https://t.co/qlx6m4wWvN",2020-02-26 17:35:04.193409,Mon Feb 24 14:06:10 +0000 2020
8,1231920040225705990,Giorgia_Meloni,433,"Di fronte a una possibile epidemia si può lavorare insieme, ma non si inventino scuse per fare altre cose. Nemmeno #coronavirus potrà convincermi a fare un governo con Conte, Renzi, Zingaretti e Di Maio. Ecco la mia intervista a @LaStampa di oggi. #COVID19
https://t.co/iBGlk1KhpK",2020-02-26 17:35:04.193854,Mon Feb 24 12:33:20 +0000 2020
9,1231857657771970560,Giorgia_Meloni,244,"Oltre al dramma sanitario, #coronavirus rischia di produrre danni terribili anche all'economia. Lo ha spiegato bene @MaurizioLeo6. FDI chiede al Governo un piano straordinario per garantire stabilità sociale ed evitare recessione. Pronti a dare nostro contributo. #COVID19italia https://t.co/6cj5ZS7ECp",2020-02-26 17:35:04.194245,Mon Feb 24 08:25:27 +0000 2020
10,1231330714039259136,Giorgia_Meloni,489,"Fratelli d’Italia è stato contattato dal Governo per l’emergenza #coronavirus. Abbiamo ribadito la nostra massima collaborazione per tutelare la salute dei cittadini e per sostenere ogni misura utile a contenere il contagio.
#coronarvirusitalia",2020-02-26 17:35:04.194666,Sat Feb 22 21:31:33 +0000 2020
11,1231225074914648064,Giorgia_Meloni,53,"Al Mercato di Campagna Amica al Circo Massimo, insieme a @MaurizioLeo6, il candidato del centrodestra alle elezioni suppletive di Roma per il Collegio 1 del prossimo 1° marzo. 
#DifendiamoilMadeinItaly 🇮🇹 https://t.co/1F67FQoUTt",2020-02-26 17:35:04.195059,Sat Feb 22 14:31:47 +0000 2020
12,1231215858254581760,Giorgia_Meloni,93,"Linciaggio al quale si aggiunge l'incomprensibile delibera Agcom, che dovrebbe far rispettare le più elementari regole sui tempi del pluralismo violate da molte testate, anche del servizio pubblico, ma che invece preferisce sindacare le scelte editoriali e giornalistiche di un tg",2020-02-26 17:35:04.195415,Sat Feb 22 13:55:10 +0000 2020
13,1231215856354549761,Giorgia_Meloni,342,"Solidarietà al direttore del Tg2 @GenSangiuliano, oggetto di una campagna denigratoria senza precedenti messa in piedi dalla solita sinistra che non tollera chi la pensa diversamente e pretende per se il monopolio dell'informazione.",2020-02-26 17:35:04.195834,Sat Feb 22 13:55:09 +0000 2020
14,1231197720523788290,Giorgia_Meloni,848,"Coronavirus, Fratelli d'Italia chiede al Governo di riferire in Parlamento: gli italiani hanno bisogno di risposte! #coronarvirusitalia https://t.co/Dd1gmaqx1i",2020-02-26 17:35:04.196180,Sat Feb 22 12:43:05 +0000 2020
15,1231174995575005185,Giorgia_Meloni,104,"Tantissima gente questa mattina in fila ai banchetti di #FratellidItalia per firmare le quattro proposte di iniziativa popolare per cambiare l’Italia. Voi siete già passati? 🇮🇹

Ecco dove poter firmare⏬
https://t.co/4TIfjQ77md #FIRMAPERLITALIA https://t.co/2UAs2M8Ys7",2020-02-26 17:35:04.196413,Sat Feb 22 11:12:47 +0000 2020
16,1231144872842874880,Giorgia_Meloni,275,"Raggi e Zingaretti, M5S e Pd, due facce della stessa identica sinistra. Mandiamoli a casa! https://t.co/08cDvCPc95",2020-02-26 17:35:04.196788,Sat Feb 22 09:13:05 +0000 2020
17,1230908172698898432,Giorgia_Meloni,244,"4 proposte per cambiare il futuro della nostra Nazione: domani #22febbraio venite a firmarle ai nostri banchetti in tutta Italia.
Firma per l'Italia! ✍🏻🇮🇹

Per info ⏬
https://t.co/4TIfjQ77md #firmaperlitalia https://t.co/DRfPH8wvIl",2020-02-26 17:35:04.196946,Fri Feb 21 17:32:32 +0000 2020
18,1230855834072223744,Giorgia_Meloni,884,"Per l’emergenza mondiale #coronavirus serve serietà, buonsenso e fermezza. Chi arriva dalla Cina o da eventuali zone reputate ad alto rischio deve essere tenuto in quarantena, per il bene di tutti. Non si perda altro tempo.
#coronavirusitalia",2020-02-26 17:35:04.197268,Fri Feb 21 14:04:33 +0000 2020
19,1230849570000818176,Giorgia_Meloni,47,"📺 Ci vediamo questa sera a @sonoleventi su @nove!

#SonoLeVenti #Meloni https://t.co/zPqOVveiQp",2020-02-26 17:35:04.197653,Fri Feb 21 13:39:40 +0000 2020
20,1230814066249289730,Giorgia_Meloni,84,"Visita al Mercato Trionfale con @MaurizioLeo6, candidato del centrodestra alle elezioni suppletive di Roma per il Collegio 1 del prossimo 1° marzo https://t.co/p0hYjgYz3O",2020-02-26 17:35:04.197782,Fri Feb 21 11:18:35 +0000 2020
21,1230623877950300161,Giorgia_Meloni,533,Impensabile che chi viola nostri confini e sperona una motovedetta della GDF non paghi per ciò che ha fatto. Così viene sancito il diritto a violare le nostre leggi e i trafficanti di esseri umani potranno continuare a mettere a rischio la vita degli immigrati senza ripercussioni https://t.co/EclX4jyx7v,2020-02-26 17:35:04.198024,Thu Feb 20 22:42:51 +0000 2020
22,1230613828733489153,Giorgia_Meloni,135,"📺 Avete seguito #PiazzaPulita? Che dite, me la sono cavata? https://t.co/bv1U3XM9Fu",2020-02-26 17:35:04.198464,Thu Feb 20 22:02:55 +0000 2020
23,1230576281521197057,Giorgia_Meloni,218,"In Campidoglio M5S e Pd votano per bloccare sgomberi palazzi occupati. Raggi e grillini urlavano ""onestà"" e ""legalità"" ma si sono ritrovati complici dei #centrisociali. Altra ragione per mandarli a casa e per votare l'1 marzo @MaurizioLeo6 alle suppletive nel collegio Roma Centro",2020-02-26 17:35:04.198557,Thu Feb 20 19:33:43 +0000 2020
24,1230525058478739459,Giorgia_Meloni,73,📺 Questa sera a #PiazzaPulita su La7! Mi seguite? https://t.co/ochLuhI0mM,2020-02-26 17:35:04.198897,Thu Feb 20 16:10:10 +0000 2020
25,1230493271799062529,Giorgia_Meloni,67,"Se Renzi non cambia nuovamente idea, sabato può venire a uno dei 1000 banchetti allestiti da #FratellidItalia su tutto il territorio nazionale a firmare la nostra proposta d'iniziativa popolare sull'elezione diretta del Presidente della Repubblica. (3/3) https://t.co/1TXt3qa1Rl",2020-02-26 17:35:04.198978,Thu Feb 20 14:03:52 +0000 2020
26,1230493260856143873,Giorgia_Meloni,48,"Noi realizzeremo l'elezione diretta del Capo dello Stato grazie al mandato che, insieme al centrodestra, riceverà dal popolo italiano. Si chiuda al più presto questa legislatura, ora dai tratti grotteschi, e si consenta agli italiani di dire la loro. (2/3)",2020-02-26 17:35:04.199298,Thu Feb 20 14:03:49 +0000 2020
27,1230493258217934853,Giorgia_Meloni,110,"La riforma presidenziale o l'introduzione del premierato, storiche battaglie della Destra, sono temi troppo seri per essere utilizzati come biechi strumenti di manovre politiche e di Palazzo come sta facendo Renzi con il suo ben poco credibile appello. (1/3) https://t.co/2w86jtsfOh",2020-02-26 17:35:04.199602,Thu Feb 20 14:03:48 +0000 2020
28,1230442952851369984,Giorgia_Meloni,76,Agli Stati generali della professione dei dottori commercialisti e degli esperti contabili. Collegatevi per seguire il mio intervento in diretta: https://t.co/e5EfOyGwSj https://t.co/2U2QpnUI6z,2020-02-26 17:35:04.199916,Thu Feb 20 10:43:55 +0000 2020
29,1230425015784542208,Giorgia_Meloni,268,"Quello che è accaduto ad #Hanau è disumano. Cordoglio e vicinanza al popolo tedesco, colpito da un crimine orribile che ci lascia sconcertati e che condanniamo con fermezza. Nella nostra Europa non c'è nessuno spazio per terrorismo, razzismo e xenofobia https://t.co/m18vRYmJVl",2020-02-26 17:35:04.200105,Thu Feb 20 09:32:38 +0000 2020
30,1230194012218413062,Giorgia_Meloni,548,"Se si può impedire l’arrivo di armi dalla Libia, allora si può fermare anche il traffico di esseri umani da parte degli scafisti. Tutti quelli che ci avevano spiegato che il #blocconavale non si poteva fare dove sono finiti? https://t.co/cXtUHjebnh",2020-02-26 17:35:04.200418,Wed Feb 19 18:14:43 +0000 2020
31,1230146400115154946,Giorgia_Meloni,175,"🔴 STOP VIOLENZA SUI CAMICI BIANCHI!
#FratellidItalia lavora da tempo in Parlamento per attribuire lo status di pubblico ufficiale a #medici e #infermieri in servizio e nelle Regioni per introdurre delle misure di prevenzione e sicurezza, come telecamere e collegamento con FFOO https://t.co/KuSmGvX9y3",2020-02-26 17:35:04.200711,Wed Feb 19 15:05:31 +0000 2020
32,1230109462263930880,Giorgia_Meloni,519,"È ora di mandare a casa questi nemici dell'Italia, degli italiani e della democrazia. #ElezioniSubito https://t.co/xd9AoxLU6m",2020-02-26 17:35:04.201064,Wed Feb 19 12:38:44 +0000 2020
33,1230073405820588033,Giorgia_Meloni,49,"Al Senato per la conferenza stampa: “No alla violenza sui camici bianchi. Misure a supporto, dal Parlamento alle Regioni”. Difendiamo chi difende la nostra salute!

▶️ https://t.co/GqwQZ60WpK https://t.co/yz1E5MSxr7",2020-02-26 17:35:04.201202,Wed Feb 19 10:15:28 +0000 2020
34,1229837697130385408,Giorgia_Meloni,211,"I miei migliori auguri al nuovo assessore all’Ambiente della Regione Calabria: Sergio De Caprio.
Un onore poter avere un simbolo della lotta al crimine organizzato a collaborare nella giunta di centrodestra. Buon lavoro Capitano Ultimo https://t.co/yv6el6CoVF",2020-02-26 17:35:04.201432,Tue Feb 18 18:38:50 +0000 2020
35,1229812229006143495,Giorgia_Meloni,61,"100 anni di Garbatella! 
Buon compleanno al quartiere romano che per me è un pezzo di vita, dove sono cresciuta e che più mi rappresenta ❤
#Garbatella100 https://t.co/B13VUVyZXO",2020-02-26 17:35:04.201728,Tue Feb 18 16:57:38 +0000 2020
36,1229780409443069953,Giorgia_Meloni,454,Sembra ieri che doveva lasciare la politica… ora annuncia che se dovesse cadere il Conte bis si formerà un altro Governo di palazzo. Faremo le barricate per impedire l'ennesimo inciucio sulla pelle degli italiani e per ridare loro la possibilità di esercitare la loro sovranità https://t.co/HaucDgV2v5,2020-02-26 17:35:04.201941,Tue Feb 18 14:51:12 +0000 2020
37,1229760614836396032,Giorgia_Meloni,247,"Ucciso a 18 anni per aver osato criticare le BR in un tema a scuola. È la storia di Sergio Ramelli, infangata 45 anni dopo da un insegnante nonché assessore della giunta di centrosinistra nel III Municipio di Roma. L'odio ideologico di certa sinistra non si smentisce mai. Schifo! https://t.co/DjtMCK5W4s",2020-02-26 17:35:04.202287,Tue Feb 18 13:32:33 +0000 2020
38,1229720486592098304,Giorgia_Meloni,327,"Riforma codice rischio d'impresa: il vero obiettivo dei grillini è rendere impossibile la vita alle imprese per lasciare campo libero alle grandi multinazionali. Faremo di tutto per mandarli a casa e restituire dignità a lavoratori e piccoli imprenditori!
https://t.co/SF0ND8Nagb",2020-02-26 17:35:04.202637,Tue Feb 18 10:53:05 +0000 2020
39,1229695413558616064,Giorgia_Meloni,429,"UE sostituisce missione Sophia con pattugliamento navale e aereo per garantire embargo di armi alla Libia. Bene, ma se si può impedire arrivo armi si può impedire anche partenza barconi degli scafisti. Ora basta, serve il #blocconavale per fermare l’immigrazione illegale di massa https://t.co/LVs6V3f2uY",2020-02-26 17:35:04.202950,Tue Feb 18 09:13:27 +0000 2020
40,1229511459958349824,Giorgia_Meloni,102,Medaglia d'oro per la Nazionale Italiana Cuochi alle Olimpiadi di cucina 2020 in Germania. Con ancora maggiore orgoglio indosso oggi la divisa che i cuochi mi hanno regalato insieme alla Collana amici dei cuochi. Viva voi! 🇮🇹 https://t.co/zgLcpamwWA,2020-02-26 17:35:04.203308,Mon Feb 17 21:02:29 +0000 2020
41,1229443904438767621,Giorgia_Meloni,60,"Milano, visita al #MICAM: salone internazionale leader del settore calzaturiero. 
Anche in questo settore l'eccellenza dei prodotti italiani è chiara e riconoscibile. 
La difesa feroce del marchio e dell'alta manifattura italiana continuano a essere priorità di @FratellidItaIia https://t.co/drc0RR7J6w",2020-02-26 17:35:04.203601,Mon Feb 17 16:34:03 +0000 2020
42,1229317403491868674,Giorgia_Meloni,544,"Ignobili parole pronunciate dall'ex terrorista Etro (già percettore di reddito di cittadinanza) a #NonelArena. Spettacolo indecente con offese vergognose rivolte a Rachele Mussolini, @DSantanche e alle vittime del terrorismo negli anni '70. Bravo Giletti a cacciarlo dallo studio! https://t.co/CYIoBY2VWX",2020-02-26 17:35:04.203953,Mon Feb 17 08:11:23 +0000 2020
43,1229150541663678464,Giorgia_Meloni,235,Tutta la mia solidarietà all’amico @GiovanniToti per l'oscena scritta comparsa a Genova. Non saranno di certo simili gesti vigliacchi e pieni d’odio a intimidirlo e mi auguro che vengano condannati da tutta la politica. https://t.co/A9MNul6jG0,2020-02-26 17:35:04.204244,Sun Feb 16 21:08:20 +0000 2020
44,1229098055145787392,Giorgia_Meloni,307,"Grazie @VeltroniWalter per aver ricordato #SergioRamelli, giovane studente ucciso per la sola ""colpa"" di essere di destra. Dobbiamo impegnarci tutti affinché quegli anni bui, in cui tanti innocenti di destra e sinistra persero la vita, non tornino mai più https://t.co/nxDbe4Nf5p",2020-02-26 17:35:04.204490,Sun Feb 16 17:39:46 +0000 2020
45,1229079488597831680,Giorgia_Meloni,263,"Per quanto tempo ancora PD e M5S potranno tenere l'Italia ostaggio di questo governo ormai legato solo dall'attaccamento alle poltrone? 
Noi siamo pronti a dare all'Italia un governo di Patrioti che lavori unito per il bene della Nazione: #ElezioniSubito! https://t.co/NDIcF45KbM",2020-02-26 17:35:04.204750,Sun Feb 16 16:25:59 +0000 2020
46,1229054817579851778,Giorgia_Meloni,879,"In Finlandia non si usa quasi più la moneta contante e i cittadini scoprono di essere sovraindebitati, le banche gongolano. Anche in Italia ci esponiamo agli stessi rischi. Restituiremo agli italiani il diritto di spendere i LORO soldi come meglio credono
https://t.co/xUqf0MJJ3H",2020-02-26 17:35:04.205010,Sun Feb 16 14:47:57 +0000 2020
47,1229007910052810753,Giorgia_Meloni,935,"La paura più grande di ogni genitore...
Facciamo girare l'importante appello della mamma di Giorgia, 19enne scomparsa a Monigo (Treviso)‼️
https://t.co/UG2zjG70jq",2020-02-26 17:35:04.205270,Sun Feb 16 11:41:34 +0000 2020
48,1228711989662437379,Giorgia_Meloni,349,"Il governo è ormai alla frutta. Se è rimasto loro un briciolo di dignità, abbiano il coraggio di presentarsi davanti ai cittadini in libere elezioni. Gli italiani hanno bisogno di un Governo unito, forte e che difenda gli interessi nazionali: FDI continua a lavorare per questo 🇮🇹 https://t.co/05mOIrFXJ7",2020-02-26 17:35:04.205430,Sat Feb 15 16:05:41 +0000 2020
49,1228669028253732865,Giorgia_Meloni,246,"Sono molto felice che il nostro progetto sia sempre più apprezzato e il nostro impegno riconosciuto. Certo, è pur sempre solo un sondaggio, ma la vostra partecipazione ci dà la forza per continuare a dare il massimo per l'Italia e gli italiani. Avanti Fratelli e Sorelle d’Italia! https://t.co/h6egNWWEsj",2020-02-26 17:35:04.205729,Sat Feb 15 13:14:58 +0000 2020
50,1228622741823270914,Giorgia_Meloni,290,"Continua raccolta firme FDI per:
➡️Elezione diretta Presidente Repubblica
➡️Abolizione senatori a vita
➡️Tetto alle tasse in Costituzione
➡️Supremazia Costituzione Italiana su norme europee

Aiutaci a raccogliere 50 mila firme necessarie per ogni proposta:
https://t.co/4TIfjQ77md https://t.co/bLfEBud62c",2020-02-26 17:35:04.206030,Sat Feb 15 10:11:03 +0000 2020
51,1228428710342221825,Giorgia_Meloni,94,"Milano, cenetta a lume di candela per #FratellidItalia a San Valentino. Grazie! https://t.co/FJF6mwzFvi",2020-02-26 17:35:04.206315,Fri Feb 14 21:20:02 +0000 2020
52,1228399980936925185,Giorgia_Meloni,765,"Dittatura Gender a scuola! Drag queens, identità di genere, gay sex education: ecco le ""lezioni"" in programma in assemblea di istituto in un liceo di Bologna. Solo io ritengo assurdo che gli studenti siano obbligati a subire la solita propaganda ideologica cara al pensiero unico? https://t.co/4PYDLJtBio",2020-02-26 17:35:04.206416,Fri Feb 14 19:25:52 +0000 2020
53,1228379828736471040,Giorgia_Meloni,314,"Agenzie di rating preferiscono governicchi come quello PD-M5S, che garantisce prebende a banche e speculatori. Si rassegnino, presto daremo all'Italia un Governo che metta al centro interesse nazionale, economia reale, imprese, professionisti, partite IVA!
https://t.co/vYmAbsJrc0",2020-02-26 17:35:04.206707,Fri Feb 14 18:05:48 +0000 2020
54,1228351678518308864,Giorgia_Meloni,379,Zingaretti incontra ex presidente del Brasile da poco uscito di galera per una condanna per corruzione e riciclaggio. Lo stesso che negò estradizione #CesareBattisti offendendo l'Italia e le famiglie delle vittime. Ma Pd e governo non si vergognano di questo affronto all'Italia? https://t.co/KWirJzLzC8,2020-02-26 17:35:04.206972,Fri Feb 14 16:13:56 +0000 2020
55,1228324186759868416,Giorgia_Meloni,184,"Fratelli d'Italia sostiene gli idonei vincitori di concorso di #Polizia a cui hanno cambiato criteri di partecipazione a prove effettuate. Dopo tante promesse non mantenute dai Governi Conte, siamo ancora al loro fianco e sosteniamo l'appello per mettere fine a questa ingiustizia https://t.co/NUxn6KlQSK",2020-02-26 17:35:04.207258,Fri Feb 14 14:24:41 +0000 2020
56,1228282226976186368,Giorgia_Meloni,261,"«Mi manca da morire. Chi si mette al volante ubriaco deve sapere che non se la caverà con poco». Sono vicina a Sara e alla famiglia dell’Appuntato Anzini e come loro chiedo giustizia per un padre di famiglia ucciso mentre lavorava per la sicurezza di tutti
https://t.co/XjmK6ROAmU",2020-02-26 17:35:04.207542,Fri Feb 14 11:37:57 +0000 2020
57,1228259388739260416,Giorgia_Meloni,461,Governo alle battute finali. L'amore per la poltrona è l’unica cosa a tenerli ancora insieme. Basta giocare sulla pelle degli italiani impedendo ai cittadini di esercitare la loro sovranità: #elezionisubito per dare all’Italia un governo in grado di far ripartire questa Nazione https://t.co/BsYxwBSo5J,2020-02-26 17:35:04.207813,Fri Feb 14 10:07:12 +0000 2020
58,1228054242927267840,Giorgia_Meloni,197,Tantissimi auguri al mitico Pierluigi Collina per il suo compleanno: oggi 60 candeline. E grazie del pensiero che mi ha dedicato. Sono felice per la fiducia riposta nei miei confronti. 😘 https://t.co/fbC6OhfGHM,2020-02-26 17:35:04.208107,Thu Feb 13 20:32:02 +0000 2020
59,1228036564753821696,Giorgia_Meloni,431,"L'Italia e gli italiani sono prigionieri di un Governo diviso su tutto, senza una visione e un programma. L'unica cosa che li tiene insieme è la poltrona. Ridiamo la parola al popolo e diamo all'Italia un governo che sia alla sua altezza: @FratellidItaIia è al lavoro per questo",2020-02-26 17:35:04.208323,Thu Feb 13 19:21:47 +0000 2020
60,1227928587401093122,Giorgia_Meloni,434,"Improbabili accordi con partiti non del centrodestra? Mettiamo subito una cosa in chiaro: MAI col Pd, MAI coi 5Stelle e MAI con Renzi. Fratelli d'Italia sempre dalla stessa parte. https://t.co/ah8gVhLYCu",2020-02-26 17:35:04.208593,Thu Feb 13 12:12:43 +0000 2020
61,1227872457312395264,Giorgia_Meloni,172,"Grazie a Sebino Nela per le belle parole che mi ha dedicato nella sua intervista al Corriere dello Sport. Da tifosa romanista non posso che essere orgogliosa dei complimenti di questo grande campione italiano. 
Forza Sebino, siamo tutti con te nella tua battaglia ❤ https://t.co/OYUXSC8P2p",2020-02-26 17:35:04.208759,Thu Feb 13 08:29:41 +0000 2020
62,1227648763407278083,Giorgia_Meloni,166,Sono disgustata dagli insulti ignobili che sono stati rivolti sui social alla collega parlamentare @LAnnibali. A lei tutta la mia solidarietà e quella di @FratellidItaIia,2020-02-26 17:35:04.209003,Wed Feb 12 17:40:48 +0000 2020
63,1227643811360395265,Giorgia_Meloni,280,"Il solito bullo da tastiera Etro, ex brigatista col reddito di cittadinanza che passa le giornate a insultarmi, ora se la prende con l'esponente di FDI e consigliera comunale Rachele Mussolini. A lei la mia solidarietà, sicura che le parole di questo miserabile non la scalfiranno https://t.co/44BUhVqeG3",2020-02-26 17:35:04.209148,Wed Feb 12 17:21:07 +0000 2020
64,1227612183971930113,Giorgia_Meloni,326,"🔵VITTORIA!
La Camera dei Deputati approva la mozione di FDI contro il #Nutriscore, il sistema di etichettatura dei cibi francese pensato per danneggiare il #madeinitaly. Ora il Governo si faccia sentire con gli euroburocrati di Bruxelles! 

#NoNutriScore #DifendiamoilMadeinItaly https://t.co/dHxETRyOWV",2020-02-26 17:35:04.209393,Wed Feb 12 15:15:27 +0000 2020
65,1227592939108433921,Giorgia_Meloni,1195,"Al Senato per manifestare solidarietà a Salvini, che la sinistra vorrebbe processare per aver fatto il suo lavoro, difendendo confini italiani. Difendiamo il diritto di un ministro a fare ciò per cui gli italiani lo hanno votato, perché senza questa libertà è finita la democrazia https://t.co/BKE72tns7U",2020-02-26 17:35:04.209660,Wed Feb 12 13:58:58 +0000 2020
66,1227561736930299905,Giorgia_Meloni,114,"Prodotto italiano = qualità 🇮🇹
#FratellidItalia in piazza Montecitorio per dire NO al #NutriScore! https://t.co/Zk52JEniKL",2020-02-26 17:35:04.209905,Wed Feb 12 11:54:59 +0000 2020
67,1227295662414409729,Giorgia_Meloni,388,Toccanti le testimonianze raccontate direttamente dai parenti dei martiri delle #Foibe. Mi chiedo con che coraggio alcuni personaggi continuino ancora a propagandare revisionismo e negazionismo. Grazie a @NicolaPorro per aver dato loro voce. https://t.co/rD5j64Ugd8,2020-02-26 17:35:04.210014,Tue Feb 11 18:17:42 +0000 2020
68,1227269550305140738,Giorgia_Meloni,311,"Mila è una 16enne omosessuale francese, minacciata di morte e costretta a vivere nascosta per aver criticato l’Islam dopo aver ricevuto avance sgradite da un musulmano. Ci tengo a condividere la sua storia e a mandarle un grande abbraccio: https://t.co/twv9gI5EhM #SiamoTuttiMila https://t.co/d0YGjehA5O",2020-02-26 17:35:04.210231,Tue Feb 11 16:33:57 +0000 2020
69,1227246186224070657,Giorgia_Meloni,237,Come sempre forti coi deboli e deboli coi forti. Dobbiamo mandare a casa il prima possibile questo Governo nemico di chi lavora e produce ricchezza in Italia. https://t.co/RoTCi7HGpu,2020-02-26 17:35:04.210481,Tue Feb 11 15:01:06 +0000 2020
70,1227212519233728513,Giorgia_Meloni,599,"Norma Cossetto, italiana violentata da 17 partigiani comunisti di Tito, massacrata e infoibata, per La Repubblica di Torino è ""la fascita uccisa nelle #foibe"". Certa sinistra riesce anche a insultare i morti. Complimenti, menomale che eravate quelli contro il linguaggio d'odio https://t.co/tWdTWSw3vc",2020-02-26 17:35:04.210625,Tue Feb 11 12:47:19 +0000 2020
71,1227183959265566724,Giorgia_Meloni,86,"📺 Questa sera, a partire dalla ore 22.00, sarò ospite di Bianca Berlinguer a #Cartabianca. Seguitemi se potete! https://t.co/8IqcwhTumF",2020-02-26 17:35:04.210873,Tue Feb 11 10:53:50 +0000 2020
72,1227146364951330816,Giorgia_Meloni,1077,"Alcuni giornalisti furbetti ci provano in tutti i modi a intestarmi frasi mai dette. Che dite, avrà capito ora? https://t.co/2ZypuhPknT",2020-02-26 17:35:04.210989,Tue Feb 11 08:24:27 +0000 2020
