,tweet_id,handle,retweet_count,text,mined_at,created_at
1066,1169284915092971522,Giorgia_Meloni,479,"#Contebis governo più a sinistra della storia. Orrenda spartizione poltrone e tragica sottomissione a diktat di UE e BCE. Verrà ricordato peggio del Governo Monti. M5S placa fame poltrone e lascia vero potere al PD.
Scendiamo in piazza: NO al patto delle poltrone. #ElezioniSUBITO https://t.co/5upvHElX8L",2020-02-26 17:35:08.587778,Wed Sep 04 16:23:42 +0000 2019
1067,1169258087313747970,Giorgia_Meloni,625,Il patto della poltrona spiegato facile… https://t.co/fbOj0RAmP9,2020-02-26 17:35:08.588126,Wed Sep 04 14:37:06 +0000 2019
1068,1169210524237783041,Giorgia_Meloni,838,"Voi che dite, lascerà per sempre il Movimento o si rimangerà la parola come una Boschi qualsiasi? 
Dibba, se ci sei batti un colpo https://t.co/r44K4IjT7p",2020-02-26 17:35:08.588196,Wed Sep 04 11:28:06 +0000 2019
1069,1169185439674228736,Giorgia_Meloni,299,"Possibile che nel 2019 la capitale d’Italia non permetta ai disabili di viaggiare tranquillamente sui mezzi pubblici? L'amministrazione romana chieda scusa a questo ragazzo e l’università gli conceda di dare subito l’esame per non perdere mesi di studio.
https://t.co/XWID7N1Yvb",2020-02-26 17:35:08.588371,Wed Sep 04 09:48:25 +0000 2019
1070,1169146597319630848,Giorgia_Meloni,908,"""Sovranismo e populismo sono in Costituzione. Interpreto il concetto di sovranità e l'esercizio della stessa da parte del popolo"", parola di Giuseppe Conte (2018), lo stesso che sta per diventare premier del governo più anti-italiano, anti-sovranista e anti-popolo della storia... https://t.co/NDQAbMJvic",2020-02-26 17:35:08.588689,Wed Sep 04 07:14:05 +0000 2019
1071,1169003380901105665,Giorgia_Meloni,104,"Fede, cultura, bellezza, identità. Questa è la Macchina di Santa Rosa di Viterbo, una meraviglia tutta italiana. https://t.co/Nd4mXPghz2",2020-02-26 17:35:08.588992,Tue Sep 03 21:44:59 +0000 2019
1072,1168955093552652291,Giorgia_Meloni,1017,"Il più grande esercizio di democrazia sono le elezioni, non la farsa della Piattaforma Trouffeau a cui ha partecipato lo 0,7% dell'elettorato M5S e ha detto sì lo 0.5%. FDI non cambia idea: il giorno della fiducia saremo in piazza per dire NO patto della poltrona. #ElezioniSUBITO",2020-02-26 17:35:08.589118,Tue Sep 03 18:33:07 +0000 2019
1073,1168916680648613889,Giorgia_Meloni,419,"Ai vari esponenti cinquestelle che esultano per il grande “esercizio di democrazia” del voto online su Rousseau ricordo sommessamente che il più grande esercizio di democrazia previsto sono le libere elezioni, quelle che M5S e Pd vogliono impedire a ogni costo. 
Siete SCANDALOSI! https://t.co/xvwjL7TPRw",2020-02-26 17:35:08.589406,Tue Sep 03 16:00:28 +0000 2019
1074,1168891056278200322,Giorgia_Meloni,626,"Mestre: banda di nigeriani accerchia militari per impedire l'arresto di uno spacciatore. Poteva finire in tragedia se non fosse arriva in soccorso la Polizia. Pene più severe per chi aggredisce i nostri uomini e donne in divisa: difendiamo chi ci difende!
https://t.co/ALYrYKNxDM",2020-02-26 17:35:08.589707,Tue Sep 03 14:18:39 +0000 2019
1075,1168865672111316993,Giorgia_Meloni,203,"Ennesima vittima dei ""lavori che gli italiani non vogliono più fare"". Soluzione non è sostituire manodopera con chi accetta qualsiasi condizione, ma garantire il diritto a lavorare in sicurezza. TOLLERANZA ZERO con chi sfrutta il lavoro della povera gente!
https://t.co/gDUq84uD75",2020-02-26 17:35:08.589970,Tue Sep 03 12:37:47 +0000 2019
1076,1168838208752410624,Giorgia_Meloni,340,Il PD avrebbe proposto a Di Maio la poltrona di Ministro degli Esteri. La stessa che aveva dato ad Alfano,2020-02-26 17:35:08.590231,Tue Sep 03 10:48:39 +0000 2019
1077,1168828354302267393,Giorgia_Meloni,729,"""Questo è l’esempio dell’arroganza del potere che il 4 marzo è stato mandato a casa”.
Belle parole, peccato che il partito che è stato mandato a casa dagli italiani potrebbe tornare al Governo col M5S. Volevano smantellare un sistema “marcio”, ora ne fanno parte...#ElezioniSubito https://t.co/XarkWgNZdL",2020-02-26 17:35:08.590341,Tue Sep 03 10:09:30 +0000 2019
1078,1168804586179706880,Giorgia_Meloni,729,"In ricordo del Generale #DallaChiesa, assassinato dalla mafia insieme alla moglie e ad un agente di scorta il #3settembre 1982. A questo eroe, uomo di Stato ed esempio di integrità e coraggio, va il nostro ringraziamento e l’impegno contro ogni criminalità organizzata. Sempre. https://t.co/KG9puGVsEY",2020-02-26 17:35:08.590646,Tue Sep 03 08:35:03 +0000 2019
1079,1168603826326257664,Giorgia_Meloni,168,"46 anni fa se ne andava J. R. R. Tolkien, scrittore che ha segnato la gioventù di decine di generazioni. 
Il Signore degli anelli, Lo Hobbit, Le avventure di Tom Bombadil, Il Silmarillion: quanti sono cresciuti con i suoi straordinari libri ricchi di valori e significati? https://t.co/ofbA6gehEh",2020-02-26 17:35:08.590952,Mon Sep 02 19:17:18 +0000 2019
1080,1168578541367308298,Giorgia_Meloni,163,"🛫 SFIDA ALLE STELLE: L’ITALIA CHE PENSA IN GRANDE 🇮🇹
Pronti per la 22° edizione di Atreju? La più grande manifestazione della Destra italiana vi aspetta all’Isola Tiberina dal 20 al 22 settembre. 
Non mancate!

Info evento ⬇️ https://t.co/NyCFsKFyX4 #Atreju19 @atreju2019 https://t.co/7c3n0uH3if",2020-02-26 17:35:08.591238,Mon Sep 02 17:36:50 +0000 2019
1081,1168536699254837248,Giorgia_Meloni,635,"Un minuto di silenzio per tutti gli esponenti del PD e del M5S che in questi giorni sbiascicavano improbabili lezioni sulla Costituzione per difendere l'accordo-porcata che stanno facendo alle spalle degli italiani. BASTA con questa squallida sceneggiata, #ElezioniSUBITO! https://t.co/JrMhAtPFM4",2020-02-26 17:35:08.591530,Mon Sep 02 14:50:34 +0000 2019
1082,1168516654034239488,Giorgia_Meloni,989,"""Non esiste un Pd buono e un Pd cattivo. Se sei del Pd sei parte di un sistema pericoloso che ha impoverito questo Paese"". 
E alla fine, pur di salvare qualche poltrona, non si sono fatti troppi problemi a entrare in quel sistema. 
Per non dimenticare... https://t.co/h2wgRcOHAF",2020-02-26 17:35:08.591819,Mon Sep 02 13:30:54 +0000 2019
1083,1168466872985116674,Giorgia_Meloni,719,"Conte: ""Definirmi dei 5 stelle è inappropriato"". Pensa quanto siamo stupidi a pensare che il tizio che il 4 marzo 2018 festeggiava il risultato elettorale del M5S vicino a Di Maio, Bonafede e Di Battista fosse lui. Evidentemente ci siamo sbagliati e quello è un sosia del premier. https://t.co/4BToVsOev5",2020-02-26 17:35:08.592080,Mon Sep 02 10:13:06 +0000 2019
1084,1168451905825251329,Giorgia_Meloni,945,"Ennesima nave Ong entra in acque italiane forzando il divieto. Col governo #m5spd diventeremo il campo profughi d'Europa! Solo un governo di patrioti può difendere l'Italia dalla prepotenza delle Ong e fermare l'immigrazione clandestina col #BLOCCONAVALE.
https://t.co/86oGzOLXms",2020-02-26 17:35:08.592381,Mon Sep 02 09:13:37 +0000 2019
1085,1168415413102882817,Giorgia_Meloni,934,"Conte: “Vedo un buon clima, Pd-M5s disposti a lavorare per il Paese."" La Francia o la Germania?",2020-02-26 17:35:08.592647,Mon Sep 02 06:48:37 +0000 2019
1086,1168215222382997504,Giorgia_Meloni,169,"È sempre una grande emozione vedere la Ferrari vincere un GP! Complimenti al giovanissimo pilota monegasco, Charles Leclerc, per la sua prima vittoria in Formula 1, che sia la prima di una lunga serie!
https://t.co/n0jhOwRrcy",2020-02-26 17:35:08.592762,Sun Sep 01 17:33:08 +0000 2019
1087,1168198970230919170,Giorgia_Meloni,680,"Il giorno in cui lo sciagurato Governo #m5spd chiederà la fiducia in Parlamento scenderemo in piazza insieme a tutti quei patrioti che non si rassegnano ad essere una colonia franco-tedesca. Continueremo a batterci per un'Italia unita, libera e sovrana!
https://t.co/Eil2EbOSOO",2020-02-26 17:35:08.592975,Sun Sep 01 16:28:33 +0000 2019
1088,1168186688063123457,Giorgia_Meloni,302,"Anche @edosyloslabini e @CulturaIdentita in piazza con @FratellidItaIia a Montecitorio, il giorno della fiducia, per dire NO al governo dell'inciucio. Tutti in piazza! #ElezioniSubito https://t.co/8B9opUdYs5",2020-02-26 17:35:08.593239,Sun Sep 01 15:39:44 +0000 2019
1089,1168174181546115072,Giorgia_Meloni,1007,"Nel Pd sono così democratici, che oltre a fare di tutto per impedire ai cittadini di votare, ora vorrebbero anche impedirci di andare in piazza a manifestare contro il poltronificio governativo. 
Non ci fermeranno: appuntamento a piazza Montecitorio il giorno della fiducia! https://t.co/QYMyRShJFE",2020-02-26 17:35:08.593424,Sun Sep 01 14:50:03 +0000 2019
1090,1168158783828373505,Giorgia_Meloni,420,Sarebbe dura chiedere il consenso agli italiani dopo aver mostrato la chiara intenzione di spennarli... https://t.co/RHHFPQ9AYe,2020-02-26 17:35:08.593685,Sun Sep 01 13:48:52 +0000 2019
1091,1167842079919263744,Giorgia_Meloni,582,"Addio a Santo Pelliccia, leone della Folgore e reduce della battaglia di El Alamein. Un patriota d'altri tempi, innamorato dell'Italia e sempre fiero di indossare la sua leggendaria uniforme della Seconda Guerra Mondiale. Un esempio per intere generazioni di soldati e non solo. https://t.co/4ZQDWwJDBf",2020-02-26 17:35:08.593876,Sat Aug 31 16:50:23 +0000 2019
1092,1167761125787807744,Giorgia_Meloni,847,"Marzo 2019, quando Conte diceva che la sua esperienza di governo si sarebbe conclusa con il governo M5S-Lega.
O era il mandato ZERO anche per lui? 🤔 https://t.co/tGG3LsR2oD",2020-02-26 17:35:08.594118,Sat Aug 31 11:28:42 +0000 2019
1093,1167741361090637825,Giorgia_Meloni,426,"Su una nazione già a crescita zero si sta per abbattere il governo della patrimoniale. È proprio in questo momento che invece servirebbero scelte coraggiose, un taglio netto delle tasse e della burocrazia, legittimate dal voto degli italiani! 

https://t.co/EinRmVuMr6",2020-02-26 17:35:08.594269,Sat Aug 31 10:10:10 +0000 2019
1094,1167472241111642113,Giorgia_Meloni,277,"Le mie sentite condoglianze all'allenatore Luis Enrique per la scomparsa della figlioletta di 9 anni.
Da mamma sono atterrita da questa notizia e penso sia inimmaginabile il dolore che un genitore può provare per una tragedia così grande.
Buon viaggio piccolina. https://t.co/n9U4y564fz",2020-02-26 17:35:08.594486,Fri Aug 30 16:20:47 +0000 2019
1095,1167453541230895104,Giorgia_Meloni,473,Di Maio in piena trance agonistica da poltrone: finge un irrigidimento sul Governo Conte bis per provare a strappare nella trattativa qualche altro strapuntino #NeancheScilipoti,2020-02-26 17:35:08.594717,Fri Aug 30 15:06:29 +0000 2019
1096,1167385947991883776,Giorgia_Meloni,141,"Questa sera, dalle ore 20, sarò a Ceglie Messapica (Brindisi) in piazza Plebiscito, per la kermesse organizzata da @Affaritaliani 
Vi aspetto! 
https://t.co/d9mgV64OT7",2020-02-26 17:35:08.594874,Fri Aug 30 10:37:53 +0000 2019
1097,1167359853645504512,Giorgia_Meloni,1282,"Paradossi grillini: mandare al voto gli italiani è sbagliato, invece far votare qualche migliaio di iscritti su un blog per decidere le sorti dell'intera Nazione è democrazia. 
La democrazia diretta... a piacimento.",2020-02-26 17:35:08.595007,Fri Aug 30 08:54:12 +0000 2019
1098,1167148468474978305,Giorgia_Meloni,50,"@GiovanniToti Grazie Giovanni, ci vediamo in piazza!",2020-02-26 17:35:08.595197,Thu Aug 29 18:54:14 +0000 2019
1099,1167132650777251841,Giorgia_Meloni,1104,Governo come Bibbiano: tolgono a chi ne ha diritto e danno a chi vogliono loro!,2020-02-26 17:35:08.595244,Thu Aug 29 17:51:22 +0000 2019
1100,1167036792266252292,Giorgia_Meloni,609,"""È pura fantasia"". Bentornati nella Prima Repubblica! https://t.co/qzPNV9aDua",2020-02-26 17:35:08.595317,Thu Aug 29 11:30:28 +0000 2019
1101,1167001760747200512,Giorgia_Meloni,852,"Noi siamo pronti a scendere in piazza per dire NO al patto della poltrona. L'appuntamento è a piazza Montecitorio, il giorno della fiducia. 
TUTTI IN PIAZZA! https://t.co/jVqNyMmC3z",2020-02-26 17:35:08.595374,Thu Aug 29 09:11:16 +0000 2019
1102,1166797675586576384,Giorgia_Meloni,700,Questo governo può partire da un evidente punto in comune tra #M5S e #Pd: l'affidabilità. https://t.co/fwJpDyojSJ,2020-02-26 17:35:08.595516,Wed Aug 28 19:40:18 +0000 2019
1103,1166733459827646464,Giorgia_Meloni,944,Per noi l'unico sbocco possibile di questa crisi è il voto. Un governo di partiti che si sono candidati dicendo agli elettori che si sarebbero combattuti è un inganno. Per questo scenderemo in piazza nel caso in cui si concretizzasse il patto della poltrona. Sarete dei nostri?,2020-02-26 17:35:08.595605,Wed Aug 28 15:25:08 +0000 2019
1104,1166677111303757824,Giorgia_Meloni,1158,"Doveva lasciare per sempre la politica dopo che gli italiani lo avevano mandato a casa, ma grazie ai cinquestelle sarà il principale azionista del prossimo governo.
Ringraziamo ancora una volta il M5S per questo (non gradito) regalo. https://t.co/z9JclFB64O",2020-02-26 17:35:08.595842,Wed Aug 28 11:41:13 +0000 2019
1105,1166664130666909698,Giorgia_Meloni,1661,Ora che la sinistra si appresta a fare l’inciucio della poltrona M5S-PD vorrebbe fare passare principio che manifestare è sovversivo. Fratelli d’Italia sarà in piazza il giorno che il governo della poltrona dovesse chiedere la fiducia. Come consentito (ancora) dalla Costituzione https://t.co/aDPcXgVOkf,2020-02-26 17:35:08.596047,Wed Aug 28 10:49:38 +0000 2019
1106,1166413795704619008,Giorgia_Meloni,1118,"Maggio 2019, #DiMaio: ""Alleanza #M5sPp? Mi fa ridere, nessuno lo ha attaccato più di me. Non vogliamo far tornare al governo i partiti che gli italiani hanno mandato all'opposizione"". Ora che le poltrone sono a rischio è cambiata la musica vero?
Ecco a voi la coerenza del M5S https://t.co/9lDcjUZyhu",2020-02-26 17:35:08.880547,Tue Aug 27 18:14:54 +0000 2019
1107,1166316313452695552,Giorgia_Meloni,648,"Trattativa di #Governo #m5spd a botte di pettegolezzi tipo comari di paese: fonti #PD accusano il #M5S, fonti grilline smentiscono le fonti PD, alte fonti PD smentisco le smentite del M5S. Ma una bella diretta streaming, no? O si vergognano troppo del loro squallore?",2020-02-26 17:35:08.880898,Tue Aug 27 11:47:32 +0000 2019
1108,1166289880361705472,Giorgia_Meloni,1593,"Questo nuovo governo piace a Renzi, alla Boschi, alla Boldrini, alla Bonino, a Fico, a Prodi, a Bruxelles, alla Merkel e a Macron. 
Quanti altri motivi servono per capire che sarà un governo contro l'Italia e gli italiani?",2020-02-26 17:35:08.881225,Tue Aug 27 10:02:30 +0000 2019
1109,1166258903929237504,Giorgia_Meloni,1720,Stanno facendo di tutto per togliervi la parola. #ElezioniSUBITO https://t.co/58qmcHU3gc,2020-02-26 17:35:08.881489,Tue Aug 27 07:59:25 +0000 2019
1110,1166243386661249024,Giorgia_Meloni,611,"Il governo #m5spd ha la benedizione della Cgil. Quindi sarà ufficialmente una maledizione per famiglie e imprese italiane.
https://t.co/Pmc7VCI6s4",2020-02-26 17:35:08.881583,Tue Aug 27 06:57:45 +0000 2019
1111,1166095685537738753,Giorgia_Meloni,74,Ieri prima giornata del campionato di calcio di Serie A. In panchina abbiamo visto scendere un grande campione! #ForzaSinisa https://t.co/RTy2m3EDQp,2020-02-26 17:35:08.881743,Mon Aug 26 21:10:51 +0000 2019
1112,1166055100852428802,Giorgia_Meloni,1816,"Partito il bombardamento mediatico della sinistra contro Fratelli d’Italia. Per il PD chiedere il voto è sovversivo, andare in piazza a manifestare è sovversivo, scrivere sui social è sovversivo. Per loro solo fare inciuci di palazzo per fregare la volontà popolare è democratico.",2020-02-26 17:35:08.881902,Mon Aug 26 18:29:34 +0000 2019
1113,1166002096459735040,Giorgia_Meloni,623,Nei punti centrali citano l'Europa ma non l'Italia. In pratica si prospetta il governo più anti-italiano e schiavo dell'asse franco-tedesco della storia. https://t.co/7C6d1igYTX,2020-02-26 17:35:08.882260,Mon Aug 26 14:58:57 +0000 2019
1114,1165965739930587137,Giorgia_Meloni,160,Oggi è la #GiornataMondialeDelCane. Auguri ai nostri meravigliosi amici a quattro zampe! https://t.co/eGu8xZ3oBR,2020-02-26 17:35:08.882460,Mon Aug 26 12:34:29 +0000 2019
1115,1165945038234214400,Giorgia_Meloni,465,"Più di 50mila italiani hanno già firmato la petizione di Fratelli d'Italia per chiedere #ElezioniSUBITO. Aiutaci anche tu a dire NO ai governi di inciucio, firma qui ⬇️
https://t.co/kBhxGqD8cq https://t.co/XBzuLZETMz",2020-02-26 17:35:08.882589,Mon Aug 26 11:12:13 +0000 2019
1116,1165929065406185472,Giorgia_Meloni,1524,"Hanno gettato la maschera! Altro che alleanza per il bene della Nazione. L'accordo Pd-M5S è solo per impedire alla destra di andare al governo con i voti degli italiani. 
E questi sarebbero i democratici?
Fate girare.
#ElezioniSUBITO https://t.co/BYuhwI805H",2020-02-26 17:35:08.882829,Mon Aug 26 10:08:45 +0000 2019
1117,1165911110693859329,Giorgia_Meloni,464,Ecco 3 motivi per cui un governo Pd-M5S sarebbe un dramma per l'Italia. Oggi in edicola la mia intervista su @Libero_official https://t.co/y2DVhedNo3,2020-02-26 17:35:08.883122,Mon Aug 26 08:57:25 +0000 2019
1118,1165573829307117569,Giorgia_Meloni,573,".@FratellidItaIia scende nelle piazze italiane, in spiaggia e nei luoghi di vacanza per raccogliere le firme per chiedere #elezionisubito. Si può sottoscrivere la petizione anche online: https://t.co/kBhxGqUJB0
No ai governi di inciucio: la sovranità appartiene al popolo! https://t.co/ksaIgZKnYk",2020-02-26 17:35:08.883286,Sun Aug 25 10:37:10 +0000 2019
1119,1165530613765562368,Giorgia_Meloni,4,@robertapinotti Grazie mille per la sensibilità Roberta,2020-02-26 17:35:08.883625,Sun Aug 25 07:45:27 +0000 2019
1120,1165335903197442048,Giorgia_Meloni,970,"Il #PD è spaccato in 2, il #M5S è spaccato in 2. Si può dire che la sinistra italiana è spaccata in 4, ciononostante piddini e grillini vogliono governare lo stesso. 
Ma andare a casa no?",2020-02-26 17:35:08.883683,Sat Aug 24 18:51:44 +0000 2019
1121,1165317806872829959,Giorgia_Meloni,1026,"Ex brigatista condannato per concorso nel sequestro e nell'omicidio di Aldo Moro e nell'eccidio della scorta. 
Invece di passare il resto della vita a vergognarsi, questo mezzo uomo passa le sue giornate a insultare. Io sono il suo bersaglio preferito, ma ora basta: querelo. https://t.co/jAMSvBjyzw",2020-02-26 17:35:08.883880,Sat Aug 24 17:39:50 +0000 2019
1122,1165276532409085954,Giorgia_Meloni,260,"Chiarezza, coerenza, coraggio. Questa è la differenza tra Fratelli d'Italia e tutte le altre forze politiche. Noi siamo stati e saremo sempre dalla stessa parte.
#ElezioniSUBITO https://t.co/wHDoUO0Y2E",2020-02-26 17:35:08.884158,Sat Aug 24 14:55:49 +0000 2019
1123,1165220554762260485,Giorgia_Meloni,265,"E' venuto a mancare #CarloDellePiane, grande attore che lavorò insieme a Totò, Sordi, De Filippo, Gassman, De Sica e tantissimi altri importanti attori e registi italiani. Lo ricordiamo in questa scena insieme a Totò, da giovane, nel film Guardie e Ladri. Riposa in pace. https://t.co/kRoHRprLKB",2020-02-26 17:35:08.884351,Sat Aug 24 11:13:23 +0000 2019
1124,1165202517405425664,Giorgia_Meloni,1904,Insieme a Renzi diede la parola agli italiani che avrebbe lasciato la politica in caso di sconfitta al referendum costituzionale. Grazie al Movimento 5 Stelle questi personaggi potrebbero tornare al governo dopo essere stati mandati a casa dagli italiani. Per non dimenticare... https://t.co/xL5USwO8hw,2020-02-26 17:35:08.884626,Sat Aug 24 10:01:43 +0000 2019
1125,1164891603108061185,Giorgia_Meloni,904,Vogliono estromettere dalla democrazia chi non vuole l'immigrazione di massa e chi chiede la difesa degli interessi nazionali. Ecco perché non vogliono mandare gli italiani al voto... https://t.co/aOyrekxemv,2020-02-26 17:35:08.884908,Fri Aug 23 13:26:15 +0000 2019
1126,1164845022220623872,Giorgia_Meloni,1561,"Qualcuno valuta Roberto Fico presidente del consiglio. Un signore che ascolta l'inno nazionale con le mani in tasca, che definisce il tricolore ""striscione"" e che dedica la festa della Repubblica Italiana a rom e immigrati. Un vero incubo per l'Italia e gli italiani. https://t.co/I6IkQahWU2",2020-02-26 17:35:08.885099,Fri Aug 23 10:21:09 +0000 2019
1127,1164829240610607104,Giorgia_Meloni,965,"Patto delle poltrone: oggi alle ore 14.00 le delegazioni del #M5S e del #PD si incontreranno.
Per ""onestà"" chiediamo a Beppe Grillo e a Luigi Di Maio di trasmettere il confronto in diretta streaming. Oppure i grillini hanno cambiato idea anche su questo?",2020-02-26 17:35:08.885370,Fri Aug 23 09:18:27 +0000 2019
1128,1164791428670619648,Giorgia_Meloni,790,Era il 2016: come cambiano le cose quando c'è di mezzo qualche comoda poltrona... https://t.co/YtEpJj5Gjw,2020-02-26 17:35:08.885630,Fri Aug 23 06:48:12 +0000 2019
1129,1164631551788933125,Giorgia_Meloni,1046,"Dovevano aprire il parlamento come una scatoletta di tonno, ma per rimanere attaccati alla poltrona alla fine si sono sostituiti al tonno per rimanere chiusi nella scatoletta.",2020-02-26 17:35:08.885725,Thu Aug 22 20:12:54 +0000 2019
1130,1164629294955618304,Giorgia_Meloni,208,@GuidoCrosetto Ma ho anche trovato te. E tanti altri pazzi per i quali vale la pena di battersi fino alla fine. (E non sono affatto spigolosa) ♥️,2020-02-26 17:35:08.885903,Thu Aug 22 20:03:56 +0000 2019
1131,1164591274277687302,Giorgia_Meloni,262,"Tra i primi punti condivisi dalla sinistra versione Pd e dalla sinistra versione Movimento Cinque Stelle ci sono il No allo choc fiscale, la distribuzione di mance assistenziali, l’idea mai accantonata di una patrimoniale... No all’Inciucio delle Tasse! #ElezioniSubito https://t.co/81ZTMxaZrQ",2020-02-26 17:35:08.886059,Thu Aug 22 17:32:51 +0000 2019
1132,1164556197875396608,Giorgia_Meloni,1326,Ascoltate bene cosa accadrà se gli italiani non andranno a votare... #ElezioniSubito https://t.co/QvS6TCVCWI,2020-02-26 17:35:08.886350,Thu Aug 22 15:13:28 +0000 2019
1133,1164510909055864832,Giorgia_Meloni,726,"Ridiamo la parola agli italiani: NO ai governi di inciucio.
#ElezioniSUBITO https://t.co/tj5I4gEppu",2020-02-26 17:35:08.886452,Thu Aug 22 12:13:30 +0000 2019
1134,1164494524980314112,Giorgia_Meloni,631,Il possibile accordo M5S-Pd ha resuscitato anche personaggi come Prodi. Unica alternativa per fermare l'inciucio di governo è dare la parola agli italiani. #ElezioniSubito https://t.co/C6aZJ0364J,2020-02-26 17:35:08.886543,Thu Aug 22 11:08:24 +0000 2019
1135,1164420403428831233,Giorgia_Meloni,999,"Senza vergogna! Anche Maria Elena Boschi è pronta ad abbracciare il Movimento 5 stelle pur di rimanere incollata alla propria poltrona. Aiuterà il governo a tutelare i risparmiatori truffati dalle banche? 😓
#ElezioniSUBITO https://t.co/QnsBPRtJBy",2020-02-26 17:35:08.886724,Thu Aug 22 06:13:52 +0000 2019
1136,1164228148747218945,Giorgia_Meloni,1398,Il #Pd vota all'unanimità nella propria direzione per la prima volta in sei anni. Sono tutti d'accordo sempre e solo su una cosa: andare al #Governo fregandosene del fatto che gli italiani non ce li vogliano.,2020-02-26 17:35:08.886976,Wed Aug 21 17:29:55 +0000 2019
1137,1164200248987803648,Giorgia_Meloni,562,"Comunque vadano le cose, noi siamo pronti. Siamo pronti a rimetterci in gioco per il bene della Nazione 🇮🇹 https://t.co/uDGL0hXC07",2020-02-26 17:35:08.887187,Wed Aug 21 15:39:03 +0000 2019
1138,1164156943499485185,Giorgia_Meloni,493,"L'ex candidata M5S alla guida della Regione Abruzzo definisce Sandro Pertini “presidente del consiglio"". Durante il discorso in Senato #Conte ha parlato di ""grave carenza di cultura istituzionale"". Ora sappiamo a chi si riferiva... https://t.co/lTu3bs20nb",2020-02-26 17:35:08.887317,Wed Aug 21 12:46:58 +0000 2019
1139,1164125695301365761,Giorgia_Meloni,1820,Dagli insulti all'ipotesi di governo M5S-PD: quando l'amore per la poltrona supera ogni ostacolo. Un servizio da guardare e far girare. https://t.co/UNtreh6WQZ,2020-02-26 17:35:08.887569,Wed Aug 21 10:42:48 +0000 2019
1140,1164118819759169537,Giorgia_Meloni,362,"Ennesima violenza all'interno di un centro sociale. La mia piena vicinanza alla ragazza e TOLLERANZA ZERO per questi criminali. Fratelli d'Italia, da sempre, chiede l'immediata chiusura dei centri sociali, vere e proprie zone franche dove droga e illegalità regnano sovrane. https://t.co/q4ckLadxN3",2020-02-26 17:35:08.887720,Wed Aug 21 10:15:29 +0000 2019
1141,1163862862881861634,Giorgia_Meloni,1264,"Andremo dal Presidente Mattarella a ribadire che Fratelli d’Italia non c’è per nessun inciucio: chiediamo elezioni subito, perché dalle elezioni può nascere un governo forte e coeso, capace di difendere gli interessi italiani. https://t.co/PiMkHo12mp",2020-02-26 17:35:08.887998,Tue Aug 20 17:18:24 +0000 2019
1142,1163812096871555072,Giorgia_Meloni,429,Intervento di #Conte al Senato su #CrisiDiGoverno. Mai una poltrona ha avuto il privilegio di essere difesa con un così aulico intervento.,2020-02-26 17:35:08.888242,Tue Aug 20 13:56:41 +0000 2019
1143,1163798296088981504,Giorgia_Meloni,628,I ministri cinquestelle a dieci minuti dall'inizio dell'intervento di Giuseppe #Conte occupano tutti i banchi del governo. Ci tengono a dare un'altra plastica rappresentazione del loro attaccamento alla poltrona.,2020-02-26 17:35:08.888396,Tue Aug 20 13:01:50 +0000 2019
1144,1163793272046837760,Giorgia_Meloni,393,"Crisi governo al Senato. Possibili accordi: 
1 Governo LeU-PD-M5S
2 Coalizione Ursula LeU-PD-M5S-Forza Italia 
3 Nuovo accordo Lega-M5S 
Manca solo FdI! Noi non facciamo inciuci con la sinistra, PD o M5S che sia. Per FdI unica possibilità è governo sovranista legittimato dal voto",2020-02-26 17:35:08.888607,Tue Aug 20 12:41:52 +0000 2019
1145,1163708538771955713,Giorgia_Meloni,549,"È ora di un governo sovranista legittimato dal voto, BASTA inciuci di palazzo! https://t.co/TZGAnJUzjM",2020-02-26 17:35:08.888864,Tue Aug 20 07:05:10 +0000 2019
