,tweet_id,handle,retweet_count,text,mined_at,created_at
0,1231210757091663877,Laura_Boldrini,630,"È necessaria la collaborazione di tutte le forze politiche e il coinvolgimento di tutte le competenze mediche e scientifiche del Paese per affrontare questa emergenza 

Chi fa sciacallaggio per tornaconto elettorale soffia sul fuoco senza aiutare nessuno   

#CoronaVirusItalia",2020-02-26 17:34:51.549778,Sat Feb 22 13:34:53 +0000 2020
1,1230528557337784322,Laura_Boldrini,427,"Qualcuno mette in rete suoi video privati e lei denuncia. 

E l’azienda per cui lavora che fa? Interrompe la collaborazione perché – dice – “avrebbe subito un danno un’immagine”

Non è assurdo essere licenziati per aver subito un crimine?

#RevengePorn
https://t.co/CBleSpREIl",2020-02-26 17:34:51.550478,Thu Feb 20 16:24:04 +0000 2020
2,1230477565116239872,Laura_Boldrini,351,"“Distruggere le persone la cui espulsione dalla Germania non è più possibile”

Così sembra aver detto l’attentatore tedesco prima di compiere una strage orrenda.

L’estremismo razzista va combattuto con ogni mezzo, la cultura xenofoba può generare mostri

#Hanau",2020-02-26 17:34:51.551136,Thu Feb 20 13:01:27 +0000 2020
3,1229505839528120321,Laura_Boldrini,329,"Una città unita nel nome di Patrick Zacki, una città unita nel nome dei diritti e della libertà, una città unita che parla a nome di un Paese intero. 
Grazie #Bologna https://t.co/D0yVopwSq6",2020-02-26 17:34:51.551762,Mon Feb 17 20:40:09 +0000 2020
4,1229329037627097089,Laura_Boldrini,3059,"Decidere di abortire per una donna è una scelta difficile.

Lo “stile di vita incivile” è quello di un uomo che pur di raccattare qualche voto offende e strumentalizza le donne rimettendo in discussione i loro diritti 

#Aborto",2020-02-26 17:34:51.552166,Mon Feb 17 08:57:37 +0000 2020
5,1229312797911199744,Laura_Boldrini,15,"Fra 10 minuti, se ci siete, vi aspetto su @SkyTG24 

Buongiorno!",2020-02-26 17:34:51.552741,Mon Feb 17 07:53:05 +0000 2020
6,1229082640793374720,Laura_Boldrini,215,"“Ad Auschwitz c'era la neve

il fumo saliva lento

nel freddo giorno d'inverno”

Grazie ai “Nomadi” per avermi dato la gioia di cantare con loro una delle canzoni più belle della musica italiana https://t.co/KVDh2dWZ4P",2020-02-26 17:34:51.552923,Sun Feb 16 16:38:31 +0000 2020
7,1228364798058024961,Laura_Boldrini,79,"""Caro presidente #Conte sulle nomine di Stato il governo non dimentichi le donne"" https://t.co/58eUWjaHFK via @repubblica",2020-02-26 17:34:51.553399,Fri Feb 14 17:06:04 +0000 2020
8,1228056720703991809,Laura_Boldrini,25,"Fra una mezz’ora sono a @PiazzapulitaLA7, da @corradoformigli su @La7tv 

Se vi va, ci vediamo più tardi

Buona serata",2020-02-26 17:34:51.553661,Thu Feb 13 20:41:53 +0000 2020
9,1227640677359595525,Laura_Boldrini,326,"Cara @LAnnibali ti abbraccio e sono al tuo fianco. 

Non si può più tollerare questo clima di violenza. 

Dobbiamo unire le forze per un’azione realmente efficace e in grado di arginare la deriva di odio https://t.co/CmW9HtA8a0",2020-02-26 17:34:51.553947,Wed Feb 12 17:08:40 +0000 2020
10,1227283301569908737,Laura_Boldrini,219,"Per dare segnali forti, mobilitiamoci e fermiamo il riarmo dell'Egitto

#PatrickZaky
https://t.co/srH7mRq8bp",2020-02-26 17:34:51.554437,Tue Feb 11 17:28:35 +0000 2020
11,1227220687456215040,Laura_Boldrini,584,"Non ho mai avuto una casa a Porto Cervo, quindi nessun furto. 

Solo una bufala, una delle tante. 

Forse è il caso di passare tutto ai miei legali, che dite?
https://t.co/Gud4CAwUVm",2020-02-26 17:34:51.554786,Tue Feb 11 13:19:47 +0000 2020
12,1226879063186382849,Laura_Boldrini,379,"Le #foibe sono state un crimine che ha colpito tante famiglie, una tragedia orribile per il nostro Paese. 

La #IlGiornoDelRicordo non sia il pretesto per polemiche e strumentalizzazioni politiche, facciamola diventare davvero un momento di unione per tutta la comunità nazionale",2020-02-26 17:34:51.555166,Mon Feb 10 14:42:17 +0000 2020
13,1226554533037453312,Laura_Boldrini,90,"@FloraPiachica Io non ho una casa in Sardegna. Questa è una notizia falsa, una delle tante...",2020-02-26 17:34:51.555820,Sun Feb 09 17:12:43 +0000 2020
14,1226228858770292742,Laura_Boldrini,993,"Tortura, elettroshock, leggo che avrebbe subito cose terribili 

Si faccia tutto il possibile per avere informazioni sul ricercatore dell’Università di Bologna arrestato al #Cairo

Dopo quello che è successo a #GiulioRegeni in Egitto nessuno può dire “non sapevamo”",2020-02-26 17:34:51.556036,Sat Feb 08 19:38:36 +0000 2020
15,1226159702893092864,Laura_Boldrini,689,"“Essere cinesi non vuol dire essere un virus”

Ho incontrato Miao Miao Huang a Prato, dove risiede la più grande comunità cinese d’Europa

Lei vive in Italia dall’età di 6 anni e ha lanciato una campagna molto utile in questo momento 

La aiutiamo a condividerla? 
#IoNonSonoVirus https://t.co/1m81Pmy9cL",2020-02-26 17:34:51.557024,Sat Feb 08 15:03:48 +0000 2020
16,1225814542145531905,Laura_Boldrini,31,"La militanza è elemento essenziale della democrazia.

Grazie per il loro impegno politico alle amiche e agli amici del circolo #Pd del quartiere Pigneto di Roma.

Un enorme piacere che oggi siano venuti a trovarmi a Montecitorio! https://t.co/kRq0hKztQa",2020-02-26 17:34:51.557981,Fri Feb 07 16:12:16 +0000 2020
17,1225740690195435523,Laura_Boldrini,541,"Il 50% dei ragazzi fra gli 11 e i 17 anni è vittima di #bullismo

A loro vorrei dire di non abbassare la testa, di parlarne sempre con qualcuno e non sentirsi mai in colpa  

A vergognarsi devono essere prepotenti e violenti perché, credetemi, i bulli non sono per niente “fighi”",2020-02-26 17:34:51.558602,Fri Feb 07 11:18:48 +0000 2020
18,1225469379359510528,Laura_Boldrini,358,"Ce la stiamo mettendo tutta per trovare il modo di salvare la Casa Internazionale delle donne. 

Adesso mi auguro che il Presidente della Camera accolga il nostro ricorso 
https://t.co/8GA6qNIWcL",2020-02-26 17:34:51.559302,Thu Feb 06 17:20:42 +0000 2020
19,1225345097237180417,Laura_Boldrini,177,"Sono vicina alle famiglie e ai colleghi delle vittime del terribile incidente ferroviario di #Lodi

Mi auguro una pronta guarigione per i feriti 

Spezza il cuore pensare che qualcuno esce per andare al lavoro e, a casa, non ci torna più

#frecciarossa",2020-02-26 17:34:51.559817,Thu Feb 06 09:06:51 +0000 2020
20,1224999995960635395,Laura_Boldrini,1503,"“Domani chiedetevi come erano vestite le conduttrici di Sanremo, chiedetevi pure come era vestita la Jebreal ma non si chieda mai più a una donna che è stata stuprata come era vestita lei”

Le parole di Rula Jebreal a #Sanremo, uno squarcio di luce https://t.co/L1LHMC0lzH",2020-02-26 17:34:51.560420,Wed Feb 05 10:15:33 +0000 2020
21,1223978522592645120,Laura_Boldrini,958,"Il ministro Speranza ha annunciato che “il #coronavirus è stato isolato”

L’Italia è il primo Paese in Europa, un risultato straordinario conseguito da ricercatrici e ricercatori dello #Spallanzani 

Da una parte chi crea allarmismo, dall’altra chi lavora per risolvere i problemi",2020-02-26 17:34:51.561037,Sun Feb 02 14:36:34 +0000 2020
22,1223963101919313921,Laura_Boldrini,247,"1. Investire su lavoro a giovani e sostegno per l’affitto 

2. Piano straordinario per occupazione e imprenditoria femminile 

3. Abolire decreti Salvini e Bossi-Fini, cambiare legge su cittadinanza

È ora che il #Pd passi da parole a fatti. Che ne dite?
https://t.co/DmpSddcTh3",2020-02-26 17:34:51.561715,Sun Feb 02 13:35:18 +0000 2020
23,1223391095360540672,Laura_Boldrini,473,Il Regno Unito non è più nell’UE. Profonda tristezza e inquietudine. E mi torna in mente il documentario #TheGreatEuropeanDisaster di Bill Emmott e Annalisa Piras https://t.co/dDZAWaPAaX,2020-02-26 17:34:51.562363,Fri Jan 31 23:42:21 +0000 2020
24,1222824505783083008,Laura_Boldrini,627,"L’uomo che ha stalkerizzato e minacciato Giorgia Meloni ha fatto cose miserabili 

Spero che la giustizia faccia presto chiarezza su questo caso inquietante 

La mia solidarietà, da donna e madre, a Giorgia Meloni",2020-02-26 17:34:51.562797,Thu Jan 30 10:10:55 +0000 2020
25,1222188744754724865,Laura_Boldrini,2209,La prossima volta che ad Alessandra #Mussolini viene in mente di parlare di Liliana Segre conti fino a dieci,2020-02-26 17:34:51.563305,Tue Jan 28 16:04:38 +0000 2020
26,1222161444705316864,Laura_Boldrini,467,"Dopo la vittoria di #Bonaccini in #EmiliaRomagna ora tocca al governo: liberiamoci dei danni che la Lega ha causato al Paese. 

Avanti con l’abolizione dei decreti Salvini e più investimenti sul lavoro per dare una occupazione dignitosa e un futuro a ragazze e ragazzi",2020-02-26 17:34:51.563569,Tue Jan 28 14:16:09 +0000 2020
27,1221760371498913792,Laura_Boldrini,787,"“Senza la storia come fa ad esserci la memoria?”

Oggi faccio tesoro delle parole di una grande donna sopravvissuta all’Olocausto.

Perché ricordare quella vergognosa pagina della storia è un dovere della nostra generazione 

#LilianaSegre #GiornodellaMemoria https://t.co/OgJ8UHmkdA",2020-02-26 17:34:51.564283,Mon Jan 27 11:42:26 +0000 2020
28,1221147807056375808,Laura_Boldrini,357,"Alle 19.41 di quattro anni fa abbiamo perso ogni contatto con #GiulioRegeni

Questo minuto di silenzio a Roma è per dire che non molliamo, oltre che per celebrarne il ricordo

Grazie a chi è sceso in piazza per chiedere verità e giustizia https://t.co/mxE8843SBs",2020-02-26 17:34:51.564809,Sat Jan 25 19:08:19 +0000 2020
29,1221077833822482432,Laura_Boldrini,265,"Importante essere in tanti stasera al Pantheon a Roma per chiedere giustizia e verità per #GiulioRegeni a quattro anni dalla sua scomparsa. Vi aspetto in piazza! 

#4anniSenzaGiulio",2020-02-26 17:34:51.565236,Sat Jan 25 14:30:16 +0000 2020
30,1220793353513717760,Laura_Boldrini,193,"Da Paola Turci alla Boldrini, on line il Manifesto delle donne: «Domenica votate per i nostri diritti» https://t.co/UIgunwpEI7 @ilmessaggeroit",2020-02-26 17:34:51.565561,Fri Jan 24 19:39:51 +0000 2020
31,1219730354199724033,Laura_Boldrini,1987,"Oggi si è svegliato sceriffo, proprio lui che allo stadio abbraccia personaggi condannati per spaccio 

Senza nessun rispetto per le persone, le forze dell’ordine e chi la droga la combatte davvero 

Mi sa che il digiuno gli sta dando alla testa https://t.co/uOxQbY2XHg",2020-02-26 17:34:51.565784,Tue Jan 21 21:15:52 +0000 2020
32,1219652468633673730,Laura_Boldrini,404,"Anziché chiamarli “bamboccioni” direi di fare subito qualcosa di concreto per i giovani: investimenti sull’occupazione e contributo per l’affitto a chi vuole rendersi indipendente 

Che pensate di questa proposta, mi aiutate a sostenerla? 
https://t.co/XyEcBT8Zbd",2020-02-26 17:34:51.566224,Tue Jan 21 16:06:23 +0000 2020
33,1218969869569404929,Laura_Boldrini,1491,"Come si fa a non emozionarsi? 

#Bologna #6000Sardine #BellaCiao https://t.co/Kpq1o6Z1Nt",2020-02-26 17:34:51.566660,Sun Jan 19 18:53:58 +0000 2020
34,1218891851060666368,Laura_Boldrini,178,"Secondo voi, dal palco di #Sanremo, #Amadeus chiederà almeno scusa? 
https://t.co/RSziwbzw4Q",2020-02-26 17:34:51.566810,Sun Jan 19 13:43:57 +0000 2020
35,1218183408528056320,Laura_Boldrini,681,"Certo che lo è Borgonzoni, solo tu non te ne sei accorta

Invece di occuparti di me, perché non approfondisci le problematiche dell’Emilia Romagna?

A proposito, hai realizzato che non confina con il Trentino Alto Adige e che Bologna e Ferrara sono due città diverse? https://t.co/WL3XLXnicB",2020-02-26 17:34:51.566949,Fri Jan 17 14:48:52 +0000 2020
36,1217825917327814662,Laura_Boldrini,1518,"Mettere alla gogna sui social un ragazzo dislessico è ignobile 

Una cosa che solo uno spaccone da quattro soldi come Salvini poteva concepire

Un personaggio che andrebbe inserito in un progetto di recupero per cyberbulli
https://t.co/nuI0tldau5",2020-02-26 17:34:51.567426,Thu Jan 16 15:08:19 +0000 2020
37,1217747970889801728,Laura_Boldrini,410,"Ho proposto un contributo di sostegno per affitto a studenti e a ragazze/i che vogliono rendersi autonomi 

Dove prendiamo i soldi? Dall’IMU sulla prima casa per chi, di case, ne possiede tante

Finiamola di chiamarli “bamboccioni” è ora di fare qualcosa di concreto per i giovani https://t.co/v3Os80XJuu",2020-02-26 17:34:51.567818,Thu Jan 16 09:58:35 +0000 2020
38,1217448488981749760,Laura_Boldrini,590,"A Prato, per effetto dei decreti Salvini, decine di lavoratori che non prendevano lo stipendio da sette mesi sono stati multati perché protestavano in strada 

C’è poco da girarci attorno, questi provvedimenti vanno stralciati! https://t.co/ZBENn45LsA",2020-02-26 17:34:51.568322,Wed Jan 15 14:08:33 +0000 2020
39,1217400969211891715,Laura_Boldrini,614,"Avrebbe compiuto 32 anni oggi e, magari, li avrebbe festeggiati con le persone a cui teneva e a cui voleva bene.

A quelle persone, alla sua famiglia e al Paese abbiamo il dovere di fare il regalo più grande: non smettere di cercare verità e giustizia per #GiulioRegeni",2020-02-26 17:34:51.568732,Wed Jan 15 10:59:43 +0000 2020
40,1216798169654317056,Laura_Boldrini,427,"Si parla di rilanciare l’azione di governo

Propongo due cose:

1. più spazio e sostegno a donne nel lavoro e nella società

2. contributo a pagamento affitti per studenti e per chi vuole rendersi indipendente 

Invece di chiamarli “bamboccioni”, investiamo davvero sui giovani",2020-02-26 17:34:51.915035,Mon Jan 13 19:04:25 +0000 2020
41,1215324456144527360,Laura_Boldrini,226,"A Jasmine Cristallo la mia solidarietà, al sindaco, invece, resta da fare solo una cosa: dimettersi

https://t.co/Hvk9OIZ7zV",2020-02-26 17:34:51.915767,Thu Jan 09 17:28:24 +0000 2020
42,1215259056534958080,Laura_Boldrini,2338,"La Gran Bretagna dice addio all’ #Erasmus

Così hanno deciso Johnson e i suoi 

Il sovranismo al potere nega ai giovani la possibilità di fare esperienze formative e allargare gli orizzonti.

Rinchiudersi nei propri recinti non è la soluzione, ma il problema",2020-02-26 17:34:51.916050,Thu Jan 09 13:08:32 +0000 2020
43,1214911083481354240,Laura_Boldrini,1021,"#Trump ci sta trascinando in una crisi internazionale ad altissimo rischio per tutti 

E dopo un attacco missilistico la prima cosa che dice è “va tutto bene”

Ecco spiegato, in tre ciniche parole, cosa produce il sovranismo oltranzista  

#Guerra",2020-02-26 17:34:51.917015,Wed Jan 08 14:05:48 +0000 2020
44,1213853892129296386,Laura_Boldrini,784,"Che la Rai dica no a #RulaJebreal è legittimo

Ma se poi è vero che “sulla decisione hanno pesato le polemiche scatenate sui social dai sovranisti” allora non ci siamo 

Il servizio pubblico deve valutare le competenze di una persona non piegarsi alla prepotenza di chi la insulta",2020-02-26 17:34:51.917646,Sun Jan 05 16:04:54 +0000 2020
45,1213148223776403457,Laura_Boldrini,1282,"Dopo spostamento ambasciata Usa a Gerusalemme e tradimento dei curdi, il sovranista #Trump continua opera di destabilizzazione in Medio Oriente

Non si può rischiare una guerra mondiale per distrarre l’opinione pubblica dal suo impeachment e per qualche voto in più alle elezioni",2020-02-26 17:34:51.918308,Fri Jan 03 17:20:50 +0000 2020
46,1213107822512234496,Laura_Boldrini,30,"Hai ragione Valeria, è veramente un onore! https://t.co/MOG3eIzk9k",2020-02-26 17:34:51.919030,Fri Jan 03 14:40:17 +0000 2020
47,1213094693522853889,Laura_Boldrini,0,"@Animaribelle8 Ciao Paola, ti ho seguita, così puoi scrivermi un messaggio in privato. Grazie e buona giornata",2020-02-26 17:34:51.919182,Fri Jan 03 13:48:07 +0000 2020
48,1212382774918819840,Laura_Boldrini,1203,"Solidarietà e un abbraccio ad Arturo Scotto, aggredito da un branco di vigliacchi al grido di “Anna Frank sei finita nel forno” e “Duce Duce” 
Lo squadrismo non è più tollerabile ma non è più nemmeno rimandabile un intervento dello Stato per sciogliere le organizzazioni fasciste!",2020-02-26 17:34:51.919446,Wed Jan 01 14:39:13 +0000 2020
49,1212102558745006080,Laura_Boldrini,320,"“La democrazia si rafforza se le istituzioni tengono viva una ragionevole speranza”

Il governo faccia tesoro delle parole di #Mattarella nel #DiscorsoDiFineAnno 

Rimbocchiamoci le maniche per migliorare la vita dei giovani, creare lavoro dignitoso e tutelare l’ambiente",2020-02-26 17:34:51.920134,Tue Dec 31 20:05:44 +0000 2019
50,1212041855967383556,Laura_Boldrini,217,"Tanti cari auguri di
buon anno a voi!

 #HappyNewYear #31dicembre",2020-02-26 17:34:51.920819,Tue Dec 31 16:04:31 +0000 2019
51,1210573601944023049,Laura_Boldrini,342,"Il direttore di un “quotidiano” che pubblica un fotomontaggio di un giornalista imbavagliato è vergognoso.

L’ennesima vigliaccata di una cultura squadrista e anticostituzionale

Solidarietà e un abbraccio a Paolo #Berizzi",2020-02-26 17:34:51.921007,Fri Dec 27 14:50:12 +0000 2019
52,1209544675629182982,Laura_Boldrini,242,"Ovunque passiate questa #vigiliadinatale vorrei farvi arrivare i miei migliori auguri!
Laura

#BuonNatale",2020-02-26 17:34:51.921567,Tue Dec 24 18:41:37 +0000 2019
53,1209093375426777088,Laura_Boldrini,659,"Viene a sapere della morte della mamma durante l’udienza in cui era accusato di “aiuto al suicidio” per il caso #DJFabo

Poi la sentenza: assolto perché “il fatto non sussiste”

Le mie condoglianze e un grande abbraccio a Marco #Cappato",2020-02-26 17:34:51.921838,Mon Dec 23 12:48:19 +0000 2019
54,1208710881342824448,Laura_Boldrini,366,"La sua passione per la condivisione dei saperi lo ha fatto diventare il professore di tutti

Tanti tanti auguri al “poeta della scienza”.

#PieroAngela",2020-02-26 17:34:51.922405,Sun Dec 22 11:28:25 +0000 2019
55,1207955503126646784,Laura_Boldrini,96,"A Milano stasera con @civati @pfmajorino e @stanzaselvaggia parliamo de #LaGrandeNemica (che poi sarei io), il libro di @flavioaliver 

Vi aspetto alla @MondadoriStore di Piazza Duomo alle 18. 

Ci siete?",2020-02-26 17:34:51.922956,Fri Dec 20 09:26:49 +0000 2019
56,1206599014910775296,Laura_Boldrini,1,"@gmauro20 Hai ragione, un atto dovuto. Meglio tardi che mai in ogni caso, no?",2020-02-26 17:34:51.923412,Mon Dec 16 15:36:37 +0000 2019
57,1206585142891995136,Laura_Boldrini,1,@IlCaroLeader Giusto. Penso comunque “meglio tardi che mai”,2020-02-26 17:34:51.923594,Mon Dec 16 14:41:29 +0000 2019
58,1206584987761496065,Laura_Boldrini,0,@Yellow___Mellow Hai ragione. Penso comunque che sia meglio tardi che mai,2020-02-26 17:34:51.923762,Mon Dec 16 14:40:53 +0000 2019
59,1206580927767437315,Laura_Boldrini,448,"Brava Virginia Raggi che revoca l’incarico a Mario Improta. 

Chi non ha rispetto per le vittime del nazifascismo non ha niente da insegnare nelle scuole italiane.",2020-02-26 17:34:51.924026,Mon Dec 16 14:24:45 +0000 2019
60,1206558953271963649,Laura_Boldrini,474,"Penso che la libertà di ognuno finisca dove inizia quella dell’altro a non sentirsi colpito nella sua dignità 

E la satira si fa coi potenti non con le vittime, in questo caso dell’Olocausto. 

La vignetta di Mario Improta rappresenta solo il suo cinismo e non fa ridere nessuno",2020-02-26 17:34:51.924456,Mon Dec 16 12:57:25 +0000 2019
61,1205909341481648128,Laura_Boldrini,878,"Una piazza spettacolare, ma non limitiamoci a ringraziare queste persone. 

Ascoltiamo bene quello che ci stanno dicendo, non deludiamoli! 

#RomaNonSiLega https://t.co/l1Y8UNoAjI",2020-02-26 17:34:51.924996,Sat Dec 14 17:56:06 +0000 2019
62,1204807677718794240,Laura_Boldrini,735,"Ce l’abbiamo fatta, finalmente le atlete diventano professioniste!

Un altro passo è compiuto.

Adesso avanti con la battaglia sulla retribuzione: a parità di mansione, stesso salario per uomini e donne! https://t.co/tRp7mPDWae",2020-02-26 17:34:51.925457,Wed Dec 11 16:58:29 +0000 2019
63,1204773548847443968,Laura_Boldrini,377,"Combattere per ciò in cui si crede, senza arrendersi mai. 

E credere che il mondo possa diventare un posto migliore, anche quando tutti intorno a te ti dicono che non è possibile.

La forza delle idee è il motore del cambiamento

#GretaThunberg https://t.co/ldP7jZX47I",2020-02-26 17:34:51.926010,Wed Dec 11 14:42:52 +0000 2019
64,1204721747695669248,Laura_Boldrini,435,"Per la prima volta una donna, evviva.

Presidente della Corte Costituzionale è Marta #Cartabia

Buon lavoro a lei e a noi il compito di continuare con determinazione a percorrere la strada della parità di genere!",2020-02-26 17:34:51.926458,Wed Dec 11 11:17:01 +0000 2019
65,1204464636961144833,Laura_Boldrini,560,"Liliana siamo con te, sempre al tuo fianco!

#LOdioNonHaFuturo https://t.co/ITqL1gvmnD",2020-02-26 17:34:51.926837,Tue Dec 10 18:15:21 +0000 2019
66,1203694171837648896,Laura_Boldrini,380,"Se n’è andato uno degli ultimi testimoni dello sterminio ebreo ad opera dei nazisti

Un uomo che ha raccontato l’orrore di Auschwitz ai giovani

Una persona della quale ho apprezzato doti di umanità e intelligenza

Sono vicina a famiglia di #PietroTerracina e a comunità ebraica",2020-02-26 17:34:51.926972,Sun Dec 08 15:13:48 +0000 2019
67,1202970427427115008,Laura_Boldrini,190,"Con questo ordine del giorno, presentato da me e altre deputate, il governo si impegna a:
1. Verificare che ridurre l’IVA al 5% su prodotti igienici femminili compostabili comporti reale risparmio per le donne
2. Ridurre l’IVA anche sugli altri assorbenti nel 2020 
#notampontax https://t.co/ESkHGgbuEh",2020-02-26 17:34:51.927593,Fri Dec 06 15:17:54 +0000 2019
68,1202614214784946178,Laura_Boldrini,189,Sono vicina alla ministra #Lamorgese e a tutto il personale del #Viminale per questo vile atto intimidatorio https://t.co/xHn9uYRG9l,2020-02-26 17:34:52.155546,Thu Dec 05 15:42:26 +0000 2019
69,1202536965981298688,Laura_Boldrini,841,"Una canzone che ha unito l’Italia migliore e continuerà a unirla, nel segno della libertà. 

Cantiamola insieme, più forte ancora! 

#BellaCiao https://t.co/778dUax85m",2020-02-26 17:34:52.155915,Thu Dec 05 10:35:29 +0000 2019
70,1201858902012379136,Laura_Boldrini,376,"Sono cresciuta con un fratello disabile e questo, tra le varie cose, mi ha insegnato anche che le persone con disabilità offrono un’altra prospettiva che nessuno dovrebbe mai ignorare

#LadriDiCarrozzelle #Disabilità https://t.co/XD3p2qi1aO",2020-02-26 17:34:52.156369,Tue Dec 03 13:41:06 +0000 2019
71,1201827469403312129,Laura_Boldrini,132,"Congratulazioni a @EPalazzotto 
eletto Presidente della commissione d’inchiesta sulla morte di Giulio #Regeni 

Adesso tutti al lavoro, perché cercare la verità su Giulio vuol dire rendere giustizia alla sua famiglia e restituire dignità all’Italia.",2020-02-26 17:34:52.156981,Tue Dec 03 11:36:12 +0000 2019
72,1201209963307249665,Laura_Boldrini,852,"E oggi Milano, che meraviglia!

#MilanoNonSiLega https://t.co/MzCfX5ZDv1",2020-02-26 17:34:52.157755,Sun Dec 01 18:42:27 +0000 2019
73,1200111740845019136,Laura_Boldrini,906,"Grazie di cuore, siete in tantissimi a dirmi #IoStoConLaura

Sono io che sto con voi e sto con @emanuelefiano anche lui bersaglio dell’antisemitismo e dell’estrema destra

Non abbasseremo la testa, non ci fanno paura questi vigliacchi!",2020-02-26 17:34:52.702775,Thu Nov 28 17:58:30 +0000 2019
74,1199711249526861824,Laura_Boldrini,125,"100 milioni

Si aggiungono ai 212 della scorsa legislatura, a partire dal 2016

Anche quest’anno si è deciso di destinare alle popolazioni colpite dal sisma i risparmi di @Montecitorio 

Che in quelle zone si torni a vivere e a lavorare resta una priorità delle istituzioni. Bene!",2020-02-26 17:34:52.703961,Wed Nov 27 15:27:06 +0000 2019
75,1199701909059313665,Laura_Boldrini,336,"Siamo stanche di ascoltare i commenti dei ""benaltristi"" e determinate a non voler retrocedere di un millimetro su questa battaglia. 

Perché il ciclo non è un lusso!
#TamponTax 

https://t.co/kjUYUqmFHW",2020-02-26 17:34:52.704974,Wed Nov 27 14:49:59 +0000 2019
76,1199326672807452672,Laura_Boldrini,1067,"Il diritto a una corretta informazione è un principio fondamentale che la stampa dovrebbe garantire a chiunque.

Quanto vale la parola di un conduttore televisivo che diffonde fotomontaggi?

#SeQuestoÈUnGiornalista https://t.co/7FxIP8xgwA",2020-02-26 17:34:52.705702,Tue Nov 26 13:58:55 +0000 2019
77,1198911577572958208,Laura_Boldrini,1442,"Bravissimo Tiziano, hai pienamente ragione. 

Sappi che stiamo lavorando a una legge contro l’odio online. 

Non se ne può più! https://t.co/qUPTnkZgZr",2020-02-26 17:34:52.969682,Mon Nov 25 10:29:29 +0000 2019
78,1198661307890851841,Laura_Boldrini,177,"Vicina alle famiglie di chi ha perso la vita a causa del maltempo. 

Ora va dato tutto il sostegno possibile alle popolazioni colpite

Un enorme grazie ai vigili del fuoco e a tutti quelli che, in queste ore, stanno soccorrendo le persone in difficoltà",2020-02-26 17:34:52.970115,Sun Nov 24 17:55:00 +0000 2019
79,1198276199367229442,Laura_Boldrini,458,"Donne e non solo, in marcia per i diritti

Grande Zoro, tra di noi!

#PropagandaLive https://t.co/23dhJjdpFk",2020-02-26 17:34:52.970787,Sat Nov 23 16:24:43 +0000 2019
80,1198257832145100800,Laura_Boldrini,138,"In piazza con #LuchaYSiesta perché resti un patrimonio delle donne e di questa città

#NonUnaDiMeno https://t.co/WS1rli8kXe",2020-02-26 17:34:52.971049,Sat Nov 23 15:11:44 +0000 2019
81,1198195087466991616,Laura_Boldrini,234,"La parità di genere è un valore primario dell’Unione europea. Come si può allora escludere le donne dagli organi decisionali della  BCE? 

Ecco la nostra lettera a Christine Lagarde
https://t.co/iwKVgxJK1C",2020-02-26 17:34:52.971335,Sat Nov 23 11:02:24 +0000 2019
82,1197600788589273088,Laura_Boldrini,111,"A #Centocelle un bellissimo incontro con tanta gente che mi ha esposto problematiche e proposto idee per sostenere un quartiere vivo e determinato a reagire 

Uniamoci, non facciamoci dividere dalla paura. 

Sicurezza è sentirsi comunità https://t.co/4XwYaLtv5P",2020-02-26 17:34:52.971839,Thu Nov 21 19:40:53 +0000 2019
